brand,persona,headline,quote,logp
Peloton All-Access,Joy,Workout along if you feel like an All-Access freedom.,Clap along if you feel like a room without a roof.,-0.5226809202766256
Peloton All-Access,Joy,There’s an All-Access spark in everyone.,The adventure of a lifetime.,-0.5303133829888748
Peloton All-Access,Joy,Peloton All-Access is here to ride!,Happy days are here again!,-0.5691752300583399
Peloton All-Access,Joy,Peloton is the joy of life.,Variety is the spice of life.,-0.5054540878263531
Peloton All-Access,Joy,"Ride, it's All-Access!","Just dance, it's free!",-0.4927734561617328
Peloton All-Access,Joy,Can’t stop the ride! I love All-Access!,Can't stop the feeling!,-0.41405078177211574
Grammarly Premium,Anticipation,"Your polished prose is coming, you can feel it in Grammarly Premium.","Something's coming, you can feel it in the air",-0.4774776341302306
Grammarly Premium,Anticipation,Perfect grammar's coming…,something's coming,-0.5650879197065838
Grammarly Premium,Anticipation,Grammarly Premium is coming.,Something is coming.,-0.5922983280044294
Grammarly Premium,Anticipation,The best is yet to come with Grammarly Premium.,The best is yet to come.,-0.525225468172832
Grammarly Premium,Anticipation,The Grammarly Premium now awaits you.,The best is yet to come,-0.5083655778007502
Grammarly Premium,Anticipation,What happens next is up to Grammarly Premium.,What happens next...,-0.4765821163551061
Grammarly Premium,Anticipation,Grammarly Premium is mightier than the sword.,The pen is mightier than the sword.,-0.5122016986867121
Grammarly Premium,Anticipation,The wait is almost Grammarly Premium.,The wait is almost over,-0.47976961783066135
Canva Pro,Trust,Trust the Canva Pro.,Trust the process.,-0.5896081639209234
Canva Pro,Trust,Trust is the foundation of Canva Pro.,"Trust is the glue of life,",-0.5073934790216823
Canva Pro,Trust,You can't go wrong with Canva Pro.,You can't go wrong,-0.46638863358427496
Canva Pro,Trust,"Canva Pro first, but never at the cost of creativity.",Steady as she goes,-0.5118255049048248
Canva Pro,Trust,Canva Pro is the glue of design.,Trust is the glue of life.,-0.5170502187796548
Canva Pro,Trust,Trust is the Canva Pro of design.,Diamonds are forever.,-0.45873603937702834
Squarespace,Fear,The early site lands the client.,The early bird gets the worm,-0.41767950632383544
Squarespace,Fear,"You hesitate, you miss your edge. Squarespace keeps you sharp.","You snooze, you lose.",-0.5338618702230785
Squarespace,Fear,The only thing to fear is missing out on Squarespace.,Now or never,-0.4799975913698791
Squarespace,Fear,"You snooze your site, you lose your audience – Squarespace keeps you awake.",The only thing we have to fear is fear itself.,-0.4503414753992566
Squarespace,Fear,The early designer catches the website.,The early bird catches the worm.,-0.4209989688413985
Squarespace,Fear,"If you build your site, they’ll follow.","If you build it, he will come.",-0.3657122568154027
Squarespace,Fear,What are you waiting for? Build your site now.,What are you waiting for?,-0.46296982801415854
Squarespace,Fear,The Squarespace user gets the worm.,The early bird gets the worm,-0.4949503713706764
Squarespace,Fear,The early bird catches your audience with Squarespace.,The early bird catches the worm,-0.4304931522550601
Microsoft 365,Pride,Microsoft 365 is mightier than the sword.,The pen is mightier than the sword.,-0.4452273516278021
Microsoft 365,Pride,You miss 100% of goals you don’t Microsoft 365 achieve.,,-0.411864190722392
Microsoft 365,Pride,The Microsoft 365 way is yet to come.,The best is yet to come,-0.42943908728314617
Microsoft 365,Pride,"We are the innovators, your team.","We are the champions, my friends.",-0.4806345918322684
Microsoft 365,Pride,"Microsoft 365 isn’t everything, but wanting to succeed is.","Winning isn’t everything, but wanting to win is.",-0.45427721374745683
NordVPN,Joy,The online world is yours to explore securely!,,-0.46362734263425376
NordVPN,Joy,Joy awaits everywhere with NordVPN.,Adventure awaits everywhere.,-0.591357400771394
NordVPN,Joy,"Life is a playground with NordVPN, and you're invited.",Don't worry,-0.5476947285546463
NordVPN,Joy,The NordVPN adventure is just beginning.,The adventure is just beginning.,-0.5299641382548849
NordVPN,Joy,Pure Freedom Is What NordVPN's All About!,Pure imagination is what it's all about.,-0.5067919728157645
NordVPN,Joy,The digital world is yours to explore with NordVPN!,The world is yours to explore ★,-0.5853401234123204
NordVPN,Joy,The online world is your browser—don’t browse just one region.,The world is a book; don’t read just one page.,-0.5261137397104697
NordVPN,Joy,The world is yours to unlock with NordVPN.,The world is yours to explore.,-0.5469162473706026
NordVPN,Joy,The joy of NordVPN starts with one secure step.,,-0.4550209185496384
NordVPN,Joy,The world is yours to unlock — NordVPN!,The world is yours to explore!,-0.5207107070820569
Blue Apron,Anticipation,"Dinner’s coming, you can taste it in the air.",,-0.37089712389226565
Blue Apron,Anticipation,The meals are yet to arrive.,,-0.47056609114519626
Blue Apron,Anticipation,The best Blue Apron meals come to those who wait.,The best things come to those who wait.,-0.5372290758570074
Blue Apron,Anticipation,"Your next meal's arriving, I can feel it in the air.","Something's coming, I can feel it in the air.",-0.5142937090251575
Blue Apron,Anticipation,Something tantalizing this way comes with Blue Apron.,,-0.529565220890724
Blue Apron,Anticipation,"Dinner's arriving, and it's on its way!","Something's coming, and it's coming soon.",-0.4949821864169503
Blue Apron,Anticipation,The meal is yet to arrive — Blue Apron.,"Something's coming, I can feel it in the air",-0.48107868300495343
Blue Apron,Anticipation,The wait is almost delivered.,The wait is almost over.,-0.5394259595335827
Dollar Shave Club,Trust,Trust is the razors of shave.,Trust is the glue of life.,-0.5431808117306423
Dollar Shave Club,Trust,Safety is never an accident — Dollar Shave Club.,Quality is never an accident.,-0.5349930174018092
Dollar Shave Club,Trust,You can count on Dollar Shave Club.,You can count on me.,-0.5232722234721968
Dollar Shave Club,Trust,Safety is the shave that holds trust together. Dollar Shave Club.,Trust is the glue,-0.48276880384812165
Dollar Shave Club,Trust,Trust is the Dollar Shave Club of reliability.,Trust is the glue of life.,-0.4981784807066689
Dollar Shave Club,Trust,"Dollar Shave Club: Trust, but verify.",,-0.5730029120198992
Dollar Shave Club,Trust,Better smooth than irritated — Dollar Shave Club.,Better safe than sorry,-0.5374215096919353
Warby Parker,Fear,FOMO is a thief of style. Warby Parker has your perfect frame.,FOMO is a thief of joy.,-0.46535451392463695
Warby Parker,Fear,"You wait, you miss your Warby.","You snooze, you lose",-0.5210405315684238
Warby Parker,Fear,"You snooze, you miss Warby’s styles.","You snooze, you lose",-0.482529323338291
Warby Parker,Fear,He who hesitates is blind without Warby Parker.,He who hesitates is lost.,-0.4664639588265729
Warby Parker,Fear,The early bird gets the glasses. — Warby Parker.,The early bird...,-0.48531576093509465
Warby Parker,Fear,The only thing to fear is missing out.,,-0.4499749410119884
Amazon Prime,Trust,Trust is the glue of Prime delivery.,Trust is the glue of life.,-0.460497771673889
Amazon Prime,Trust,You've got a friend in Amazon Prime.,,-0.5245376434059692
Amazon Prime,Trust,"Trust me, I'm a Prime pro.","Trust me, I’m a doctor.",-0.5263136196842371
Amazon Prime,Trust,Trust is the Prime of delivery.,,-0.413757299930676
Amazon Prime,Trust,You can trust Amazon Prime with your deliveries.,You can trust me with your life.,-0.5299697602110449
Amazon Prime,Trust,Trust is the safety net of Prime membership.,Trust is the glue of life.,-0.5603668139513871
Amazon Prime,Trust,Better reliable than sorry | with Amazon Prime delivery.,Better safe than sorry.,-0.5554592151096777
Amazon Prime,Trust,You're in trusted hands with Prime.,You're in good hands.,-0.5421909467416728
Amazon Prime,Trust,Amazon Prime is the reliable glue of life.,Trust is the glue of life,-0.45207823167137146
Disney+,Fear,"You wait, you miss Disney+.","You snooze, you lose",-0.5011283603170082
Amazon Prime,Trust,You've got a friend in Amazon Prime.,You've got a friend in me,-0.49925691770912006
Amazon Prime,Trust,Trust is the key to Prime.,,-0.5061970576299718
Amazon Prime,Trust,Amazon Prime is the glue of delivery.,Trust is the glue of life.,-0.5002657401849413
Amazon Prime,Trust,You're in Prime's trusted care.,You're in safe hands.,-0.6100709083363833
Amazon Prime,Trust,Amazon Prime is the glue of life.,,-0.502967627737274
Amazon Prime,Trust,There’s no place like Prime.,There’s no place like home.
Amazon Prime,Trust,Amazon Prime is the glue of reliable delivery.,
Amazon Prime,Trust,Amazon Prime is the glue of reliable delivery.,Trust is the glue of life.
