headline,score,reason
The endurance of conquest—Patagonia Jackets.,3,Concise and error-free but vague phrasing may weaken clarity and appeal.
"Wear Patagonia, king of the world!",3,"Short and catchy with no rule violations, but message is vague and only mildly compelling."
Patagonia: To the summit and beyond!,4,"Concise, grammatically sound, brand-led subject that evokes adventure and curiosity without spammy elements."
"I braved, I endured, I conquered. — Patagonia Jackets.",4,"Evocative, concise phrasing sparks curiosity and links adventure with Patagonia jackets, enticing readers without spammy elements."
"Patagonia Jackets: The Master of the Elements, Captain of Your Journey.",2,"Headline exceeds 60 characters, triggering length penalty despite otherwise creative wording."
The trails the Timberland adventure!,2,"Phrase structure is incorrect, making the headline grammatically awkward and unclear."
Why not go out in Timberland? Isnt that where the joy is?,2,"Missing apostrophe in 'Isnt' is a clear grammatical error, forcing a hard-fail score despite the otherwise engaging concept."
The trail is the limit with Timberland Boots!,4,"Catchy wordplay evokes outdoor adventure and clearly names the product, keeping the line concise and engaging."
"Where the rugged paths are, Timberland Boots tread.",4,"Poetic, concise, brand-focused headline without trigger issues, effectively conjures adventure while staying under length limits."
The adventure is with Timberland.,3,"Clear, concise and relevant but lacks urgency or a strong hook to drive higher engagement."
Timberland adventure is out there!,3,Catchy and concise but somewhat generic without clear benefit or urgency.
GoPro: The adventure is out there.,4,"Concise, brand-forward and aspirational; evokes curiosity without spam tactics or errors."
What lies ahead is your GoPro-ready moment.,3,"Intriguing and concise, but vague about the email’s benefit, limiting impact."
The moment of a lifetime awaits with GoPro.,4,"Concise, grammatically sound, brand-specific, and emotionally enticing, though somewhat generic in phrasing."
The next adventure is the one you dont capture.,2,"Obvious spelling error ('dont') hurts credibility despite an intriguing, concise concept."
"Adventures coming, I can capture it. — GoPro.",2,"Missing verb and number mismatch make the headline grammatically incorrect, triggering the grammar hard-fail."
Better filtered with Brita than sorry.,4,"Clever twist on a familiar saying, concise and brand-focused, effectively highlighting the benefit without spammy elements."
An ounce of filtration is worth a pound of contaminants.,4,"Clever twist on a familiar saying, concise, grammatically sound, and clearly conveys the value of filtration without spammy elements."
Brita keeps water safe.,3,Clear and concise but lacks urgency or distinctiveness to strongly entice opens.
Pure as Brita water.,2,"Missing initial “As” creates an obvious grammatical error, triggering the grammar hard-fail rule."
You can trust Brita like purity flows naturally.,2,"Awkward, ungrammatical phrase “like purity flows naturally” hurts clarity and trust."
Trust is the Brita of safety.,3,"Creative metaphor but somewhat vague, may intrigue yet risks confusing readers without clear context."
Trust is the filter of clean water.,3,"Metaphoric headline is concise and error-free but too vague to convey a clear, concrete benefit."
The Tupperware user gets the freshness.,2,Awkward wording feels unnatural and fails to convey a compelling benefit or hook.
Better Tupperware than sorry.,4,"A clever, concise pun on a familiar phrase grabs attention and clearly hints at a Tupperware product focus."
Better to have stored and savored than never to store at all.,2,"The headline exceeds the 60-character limit, triggering a hard-fail rule."
The Tupperware users get the fresh meals.,2,Awkward phrasing and weak value proposition make the headline feel unengaging and unclear.
Time and tide wait for no meal.,4,"A concise, punny twist on a familiar phrase creates urgency and curiosity without violating length or clarity."
"You wait, you waste.",3,"Short and urgent but vague; lacks context to clearly convey benefit, yet free of length, grammar, and spam issues."
"You snooze, you spoil – Tupperware keeps it fresh.",4,"Clever wordplay highlights the freshness benefit concisely, under 60 characters and grammatically sound."
The food is always fresher with Tupperware containers.,3,"Clear benefit stated but lacks urgency or novelty, making it solid yet unremarkable."
"If not Tupperware, when?",4,"Clever, concise play on a familiar phrase sparks curiosity without any spam or length issues."
Prime favors the bold.,3,"Short and grammatical twist on a familiar phrase, intriguing yet potentially vague without context."
Amazon Prime is the king of entertainment!,3,"Engaging but vague, uses mild hype without detailing benefits or prompting action."
The best Prime perks are worth waiting for.,4,"Clear, concise, benefit-oriented headline that entices curiosity without spam tactics."
Top of the Prime membership.,2,"The headline is awkward and unclear, providing little context or motivation for the reader to open the email."
Pride is the fuel for Prime achievements.,3,"Clear and concise but vague about the offer, making impact and relevance only average."
"We are the champions, Amazon Prime members.",4,"Catchy song reference personalized to Prime members, concise and grammatically sound, likely to engage curiosity without spammy elements."
Live the Prime dream.,4,"Short, grammatically solid, brand-reinforcing phrase that entices curiosity without feeling spammy."
The highest honor is to be an Amazon Prime member.,3,"Clear and within length, but hyperbolic wording feels clichéd and offers little specific value to entice opens."
"Hakuna Matata, what a wonderful Netflix binge!",4,"Catchy Disney reference ties neatly to Netflix binge idea, concise and grammatically sound."
Netflix is the best medicine.,4,"Short, grammatically sound, curiosity-piquing metaphor that feels playful without overselling."
Netflix never stops!,3,"Short, catchy and error-free, but generic and lacks a clear benefit or specific hook."
Every show is streamable!,3,"Clear, short and grammatically correct but generic and slightly unbelievable, offering average engagement."
Where every binge is Netflix-legendary!,4,"Snappy, on-brand, under length limits, and energizing without spammy punctuation."
Netflix is out there.,3,"Short, error-free, but vague and offers little reason or urgency to open."
Netflix! What a wonderful binge!,1,"Two exclamation marks violate the spam_caps rule, resulting in automatic failure."
"New beats are coming, you can feel them everywhere.",3,"Clear and within length limits, but vague teaser language limits impact and specificity."
"Apple Musics streaming, you can feel it in the air tonight.",2,"Incorrect pluralization and missing apostrophe create a clear grammar error, forcing a low score."
Your next hit is yet to come.,3,"Concise and error-free, but vague wording offers limited clarity or compelling value."
Whats next is your music?,2,"Missing apostrophe and awkward phrasing create a clear grammar error, triggering hard-fail."
Apple Musics hits are in the stream tonight.,2,"Missing apostrophe in “Apple Music's” causes a clear grammatical error, triggering a hard-fail."
"Musics coming, you can feel it in your stream.",2,Obvious grammar error ('Musics coming') undermines clarity and professionalism.
Plot twist: Apple Music streams first.,4,"Short, creative and intriguing without errors, though slightly vague about the email’s actual content."
"Apples coming, youll hear it in the air.",2,"Missing apostrophe in 'you'll' creates an obvious grammar error, triggering hard-fail."
Better Premium than sorry.,3,"Short and punchy wordplay, but message is vague and slightly awkward, offering minimal clarity on the email’s value proposition."
You can trust Spotify Premium with every listen.,3,"Clear and within length limits, but wording is vague and not especially compelling or action-oriented."
Youre in Premium hands.,2,"Missing apostrophe in “You’re” is a clear grammar mistake, forcing a poor score."
Trust is the glue of Spotify Premium.,3,"Intriguing phrase but vague on benefits and may confuse readers, yet concise and grammatically sound."
Youve got the best playlist in Spotify Premium.,2,"Missing apostrophe in “You've” is a clear grammar error, triggering the hard-fail rule."
Youre in Premium hands.,2,"Missing apostrophe in “You’re” creates an obvious grammar error, triggering a hard-fail."
You can trust Spotify to keep you safe.,3,"Clear and concise but lacks urgency or uniqueness, making it an average-quality subject line."
Trust is the beats of playlists.,2,Awkward phrasing—“beats” is ungrammatical here—triggers the grammar hard-fail rule.
Better safe than Premium-free.,3,"Concise and punny but ambiguity around 'Premium-free' may confuse readers, giving only average persuasive power."
Spotify Premium is the glue that holds your listening together.,2,"At 63 characters, the headline exceeds the 60-character limit, triggering a length penalty."
The only thing you have to fear is missing out on Audible.,4,Clever twist on famous quote creates urgency and brand relevance while staying concise and error-free.
"Carpe diem, seize the day, listeners—hear stories extraordinary.",2,"Headline exceeds 60 characters, invoking hard-fail length rule."
Time waits for no listener.,4,"Clever, concise twist on a familiar phrase that sparks curiosity without triggering spam or length issues."
Audibles stories wait for no listener.,2,"Missing possessive apostrophe creates a clear grammatical error, forcing a low score."
Audible waits for no listener.,4,"Clever, concise spin on a familiar phrase creates urgency while highlighting the brand."
"Seize the stories, and make the most of them.",3,"Clear and grammatically sound but vague and lacks a compelling, specific value proposition."
He who pauses misses stories.,3,"Intriguing and concise, but its vagueness about content may limit engagement, yielding an average-quality headline."
The fear of missing out is gone with Audible.,3,"Clear and concise but phrasing feels slightly awkward and lacks a strong hook, yielding average impact."
The only thing we have to fear is missing Audible.,4,"Clever play on famous quote, concise and brand-specific, creating curiosity without spam or errors."
"Audiobooks knock, but later.",2,"Phrase is confusing and ungrammatical, triggering grammar hard-fail and capping quality at 2."
Live like a DashPass VIP.,4,"Short, clear, and enticing; conveys exclusivity and benefits without spammy elements."
Live like a DashPass member.,4,"Concise, on-brand tagline that sparks curiosity about membership benefits without any grammatical or spam issues."
We are the VIPs with DashPass.,3,"Grammatically sound and concise, but the value proposition feels vague and less compelling, so impact is only average."
…,2,"Ellipsis alone provides no information, lacks engagement, and fails typical headline standards."
DashPass members are the kings of the delivery world.,3,"Engaging phrase but vague on benefits, providing average clarity and motivation."
"DashPass members are the champions, my friends.",4,"Clever, concise lyric twist feels engaging and on-brand, with correct grammar and good length."
We are the DashPass members.,2,"Headline is vague and uninspiring, offering no clear benefit or action, reducing likely engagement."
DashPass is forever.,4,"Concise, grammatically sound, evokes curiosity about a permanent benefit, but could give slightly more context."
Life is an Uber One ride.,3,"Catchy and concise but vague; lacks clear benefit or call-to-action, making it average overall."
Life is a beautiful Uber One ride!,4,"Catchy, brand-specific, under 60 characters, and free of grammar or spam issues."
"Life is a Uber One, explore it all night long.",2,"Incorrect article usage (“a Uber”), hurting credibility despite creative concept."
Life is an Uber One journey.,3,"Catchy and concise but vague; it lacks clear value or action, making impact only average."
"Life is a highway, ride Uber One!",4,"Catchy, concise metaphor ties travel to Uber One; engaging without hard-trigger issues."
The best things in life are yours with Uber One!,3,"Concise and error-free, yet relies on a vague cliché and lacks concrete benefit details."
The adventure is yet to come with Marriott Bonvoy.,3,"Grammatically correct and concise but phrasing feels vague, offering only average engagement."
"Bonvoys coming, you can feel it in the air.",2,Missing apostrophe or verb in 'Bonvoys coming' creates a noticeable grammar error.
The greatest Bonvoy journey is just beginning.,4,"Evokes curiosity and excitement with clear brand reference, concise and grammatically sound, though benefits remain vague."
Bonvoy moments are out there.,3,"Short and curiosity-inducing but vague, offering no clear benefit or action to the reader."
Your next escape is waiting at Marriott Bonvoy.,4,"Concise, grammatically sound, brand-specific headline that evokes travel inspiration without spammy elements."
"Somewhere, a Marriott adventure is waiting to be explored.",4,"Evocative and concise, the headline sparks curiosity and aligns with Marriott travel themes without errors or spam cues, though it remains somewhat generic."
Marriott Bonvoy is out there!,3,"Short, grammatically fine, but vague and lacks a clear benefit or call-to-action."
"Rest easy, knowing youre in Hilton Honors care.",2,"Missing apostrophe in 'you're' creates a noticeable grammar error, triggering a hard-rule deduction despite the otherwise concise, relevant headline."
Safety in Hilton Honors hotels.,3,Clear and concise but lacks urgency or a compelling hook to drive opens.
Theres no place like Hilton Honors.,2,"Missing apostrophe in 'There's' is an obvious grammar mistake, triggering a hard fail and lowering the headline’s quality."
Safety is the glue of journey.,2,"Grammatical error—missing article in “the glue of journey” disrupts clarity and professionalism, warranting a hard fail despite concise length."
Hilton Honors is the guardian of journeys.,3,"Clear and grammatical but vague and lacks a compelling, action-oriented benefit."
Safe as Hilton Honors goes.,2,"Phrase is awkward and ungrammatical—missing expected words like “as far as,” hurting clarity and professionalism."
Trust is the Hilton Honors guarantee of everything.,3,"Grammatically sound and concise, but wording is vague and lacks a clear, compelling benefit."
Theres no place like Hilton.,2,"Missing apostrophe in “Theres” causes a glaring grammar error, triggering hard-fail."
Youve got a home in Hilton Honors.,2,Missing apostrophe in “You've” creates a visible grammar error that harms professionalism.
The only thing you have to fear is missing SkyMiles.,4,"Clever twist on a famous quote, clear benefit hinted, concise and grammatically sound."
The early traveler gets SkyMiles.,4,"Catchy proverb twist conveys urgency and reward clearly, staying concise and relevant without spammy elements."
The early traveler catches the miles.,4,"Clever twist on a familiar saying, concise and engaging, clearly hints at travel rewards."
Better earn miles too soon than lose them too late.,2,Missing the word “to” after “Better” causes an obvious grammar error that undermines the headline.
The early flyer gets Delta SkyMiles.,4,"Clever, concise play on a familiar phrase that conveys value while avoiding length, spam, or grammar issues."
Time waits for no SkyMiles.,4,"Clever, concise brand play drives curiosity without violating length or spam rules."
Miles knock but once.,2,"Cryptic and unclear, the headline fails to convey a concrete benefit or message, likely confusing readers."
SkyMiles wait for no traveler.,4,"Clever urgency play on a familiar phrase, clear and concise with no rule violations."
"You wait, you lose SkyMiles.",4,"Short, urgent, and clear play on a familiar phrase that motivates action without any rule violations."
AAdvantage Rewards favor the bold.,4,"Concise and grammatically sound, brand-specific phrase intrigues readers and urges action without spammy tactics."
Elite status is forever.,4,"Concise, grammatically solid, and aspirational, though a bit vague without added context."
Miles are an Elites best reward.,2,"Missing possessive apostrophe in 'Elites' creates a clear grammar error, invoking hard-fail and lowering the headline’s score."
You are cordially AAdvantages elite.,2,"Headline contains awkward phrasing and misspelling, making the grammar clearly incorrect."
The view from the Platinum is worth the fly.,2,"Phrase “worth the fly” feels grammatically wrong, weakening clarity and impact."
The AAdvantage Rewards from the top are worth the miles.,3,Clear intent but phrasing feels awkward and lacks strong hook or clarity.
The sky is yours with AAdvantage.,4,"Aspirational, concise headline aligns with airline loyalty benefits and has no rule violations."
You are the AAdvantage of the skies!,3,"Creative brand pun but vague on value, so only moderately engaging."
AAdvantage miles are a frequent flyers best friend.,2,"Missing possessive apostrophe creates a clear grammar error, triggering a hard fail."
Joy is the best Beauty Insider perk.,3,"Clear and concise but somewhat vague, offering moderate curiosity without strong incentive or specificity."
"Something ordinary, something Sephora!",3,"Catchy and concise, but vague messaging gives limited clarity on email’s value, making it average overall."
The best things in life are yours with Sephora Beauty Insider!,2,"Headline exceeds 60-character limit, activating hard-fail despite otherwise solid copy."
Shine bright like a Sephora Insider.,4,"Catchy, brand-specific, six-word length keeps it concise and engaging without any spam or grammar issues."
Everythings Coming Up Beauty—Sephora!,2,"Missing apostrophe in “Everything’s” creates a noticeable grammar error, triggering a hard-fail and limiting the headline’s quality score."
Everything is Sephoras best!,2,"Missing possessive apostrophe renders the headline grammatically incorrect, triggering the grammar hard-fail rule."
Gonna make them haters love my Sephora swag.,2,"Non-standard phrase “them haters” flags a grammar error, triggering a hard-fail despite the headline’s punchy tone."
"Memberships coming, I can feel it in the Nike air.",2,"Missing verb in opening phrase creates a clear grammar error, invoking hard-fail rule."
The greatest glory is in never slowing to lose.,2,"Phrase 'slowing to lose' is grammatically awkward and unclear, triggering the grammar hard-fail and weakening impact."
"The Nike Memberships so bright, I gotta wear rewards!",2,Obvious grammatical errors undermine clarity and professionalism.
Nike Membership rewards are yet to come.,3,Clear and within length limits but wording is slightly awkward and lacks urgency or strong benefit.
The Nike Membership is the hardest part.,3,"Concise and curiosity-driven, but vague on value and benefit so impact is only average."
The Nike Membership is yet to arrive.,3,Headline is clear and within length limits but lacks strong hook or urgency.
"Nike Memberships coming, I can feel it in the air.",2,"Missing verb (should read 'Nike Memberships ARE coming'), causing an obvious grammar error that undermines clarity."
"Somethings coming, Nikes here in the air.",2,"Missing apostrophes and awkward phrasing create obvious grammar errors, triggering hard fail and reducing quality."
Nike Memberships best is yet to come.,2,"Headline lacks possessive apostrophe, causing an obvious grammatical error that triggers hard-fail rule."
Safety is the glue of life – Adidas Creators Club.,3,"Clear and within length limits, but the vague metaphor offers limited urgency or specificity about what the email contains."
Adidas is the glue of creations.,2,"Metaphorical wording is vague and confusing, offering little clarity or appeal about what the email contains."
Youve got a partner in Adidas.,2,"Misspelled contraction 'Youve' violates grammar rule, triggering automatic downgrade."
A Creators word is its foundation.,2,"Missing possessive apostrophe and pronoun mismatch create obvious grammar errors, forcing a low score."
Trust is the solid foundation of every bold move.,4,"Concise, grammatically sound, motivating message with no spam or length issues."
The strength of every journey lies in the Adidas Creators Club.,2,"Headline exceeds the 60-character limit, triggering the too_long hard rule despite otherwise solid wording."
Youre in trusted hands — Adidas Creators Club.,2,"Missing apostrophe in “Youre” is a clear grammar error, forcing a low score despite otherwise concise, relevant wording."
Trust the Adidas journey.,3,"Clear, concise and error-free but lacks urgency or a concrete benefit, making it merely average."
The right Adidas gear for the job.,3,Clear and concise but lacks urgency or a unique hook to strongly entice opens.
Trust in Adidas Creators Club with all thine heart.,3,"Archaic wording is attention-getting but feels awkward and may confuse readers, yet it has no hard-fail issues and remains concise."
Achieve while your momentum lasts.,3,Brief and grammatically sound but generic and lacks clear value proposition.
"Track your progress now, so never miss a goal — Fitbit Premium.",2,"Headline exceeds 60-character limit, triggering hard-fail length rule."
Fear is the rest killer. Sleep smarter with Fitbit Premium.,4,"Concise, curiosity-provoking, and clearly links problem to solution without hard-trigger issues."
You miss 100% of your goals you dont track with Fitbit Premium.,2,Missing apostrophe in “don't” is an obvious grammar error that undermines professionalism.
The fear of missing your goals is worse than missing your health potential.,2,"Good concept but headline exceeds 60 characters and 12 words, triggering length penalty."
The only thing we have to fear is not using Fitbit Premium.,4,"Clever riff on a famous quote is catchy, on-brand, error-free, and within length limits."
Fear of missing out is a thief of health.,3,"Catchy but vague, grammatically sound and concise, yet offers limited clarity on email content."
Design is your masterpiece.,3,"Clear, short and grammatically correct, but vague on value and lacks urgency or specificity."
"The harder the work, the more glorious the Canva Pro.",3,"Catchy proverb twist but wording feels awkward and benefit unclear, yielding only average impact."
Canva Pro is your go-to tool.,3,Clear and concise but generic; lacks urgency or a specific benefit to stand out.
Your designs are yet to come with Canva Pro.,3,"Meaning is clear and length is fine, but phrasing feels awkward and less compelling."
I did it Canva Pro style.,3,"Grammar is fine and length is short, but the headline is vague and offers limited clarity or incentive."
Be the Pro you can be.,3,"Concise and error-free but generic, offering little context or specificity to entice opens."
Canva Pro is a designers best friend.,2,Missing possessive apostrophe creates a visible grammar error.
"Design, create, conquer with Canva Pro.",4,"Concise, engaging verb triad highlights Canva Pro’s benefit while staying grammatically correct and within length limits."
Be yourself; everyone else is already basic. Canva Pro.,4,Catchy twist on a famous quote aligns with Canva’s brand and stays concise without spam signals.
The skys the limit when you store with Dropbox!,2,"Missing apostrophe in “sky’s” creates a clear grammar error, triggering an automatic downgrade."
Life is a breeze with Dropbox Plus.,4,"Concise, benefit-focused headline highlights product and ease, with proper grammar and optimal length."
Your work is a Dropbox Plus party!,3,"Catchy and concise, but the party metaphor obscures the actual benefit, lowering clarity and impact."
"Work is a breeze, so share it with Dropbox Plus.",3,Headline is clear and concise but lacks a strong hook or specificity to stand out.
"Dont stress, be secure with Dropbox Plus.",2,"Missing apostrophe in “Don’t” causes a noticeable spelling error, triggering grammar hard-fail."
Dropbox Plus is now within reach!,4,"Concise, grammatically sound, evokes accessibility and curiosity without spammy tactics."
The joys the Dropbox Plus!,2,"Missing preposition creates an obvious grammar error, automatically capping the score at 2."
"Adobes tools are coming, you can feel it in the air.",2,"Missing apostrophe in “Adobe’s” causes a grammar error, invoking hard-fail rule and limiting the score to poor."
"Your creativitys coming, I can feel it in the air now.",2,"Misspelling of “creativity’s” creates a glaring grammar error, invoking the hard-fail rule."
The creativity is yet to flow.,3,"Clear and concise but lacks specific benefit or urgency, making it only moderately engaging."
"Adobes future is here, I can feel it in the cloud.",2,"Missing apostrophe in “Adobe's” is a clear grammar error, triggering a poor score."
"Somethings coming, you can sense Adobe Creative Cloud in the air tonight.",2,"Missing apostrophe and awkward phrasing create a clear grammar error, triggering a hard-fail despite the intriguing concept."
Creativity is yet to unleash.,2,"Headline contains awkward, incorrect phrasing (“is yet to unleash”) causing a noticeable grammar issue."
Adobe: The best is yet to come.,3,"Concise and grammatically sound, but vague and generic, offering limited specific value to entice opens."
"Adobes coming, you can feel it in the cloud.",2,"Obvious grammar error ('Adobes' vs 'Adobe’s') triggers hard rule, limiting the headline to a poor score."
Microsoft 365 is the glue of teamwork.,4,"Clear, concise and benefit-oriented headline without rule violations, though not exceptionally creative."
