headline,score,reason
Your vision is Photoshops to craft.,2,"Phrase is grammatically incorrect and confusing, undermining clarity and impact."
Only the brave dare to Photoshop differently.,4,Creative and concise line provokes curiosity among Photoshop users without any compliance issues.
The only way to create great work is to master Photoshop.,3,Clear and concise but uses an overstated claim that weakens credibility.
To Photoshop and beyond!,3,"Catchy and concise wordplay makes it memorable, but vague message limits clarity and value to the reader."
Youre the Photoshop master of the design world!,2,"Missing apostrophe in “Youre” creates a grammar error, triggering the hard-fail rule."
Photoshop is holding your head up when everyone else has theirs unedited.,2,"Headline is 73 characters long, exceeding the 60-character limit."
I am the master of the canvas.,3,Intriguing but vague; grammatically sound and concise yet offers limited reader benefit.
The only Photoshop limit is your imagination.,4,"Short, clear, aspirational headline that highlights Photoshop’s creative potential and entices curiosity without any rule violations."
I am the master of Photoshops artistry.,2,"Missing apostrophe in “Photoshops” is an obvious grammar error, reducing credibility."
Jump for Creative Cloud!,3,Energetic and concise but vague; lacks clarity on value or action.
"Design without limits, Creative Cloud.",3,"Conveys a clear benefit and brand, but wording feels tag-line-ish rather than compelling or action-oriented."
The Creative Clouds the playground!,2,"Grammatical construction is confusing, making the headline unclear and less compelling."
Lets paint the Creative Cloud red!,2,"Missing apostrophe in “Let’s” creates an obvious grammar error, invoking a hard-fail despite the catchy phrasing."
Lets get this Creative Cloud started!,2,"Missing apostrophe in “Let’s” creates a clear grammar error, invoking the hard-fail rule."
"Creative Cloud, what a joyful tool!",3,"Cheerful and concise, but vague benefits make it only moderately compelling."
Creative Cloud: The skys the limit.,2,Misspelling of “sky’s” undermines professionalism and triggers the grammar hard-fail rule.
Lets create ready to shine!,2,Missing apostrophe in “Let’s” and awkward phrasing make the headline feel unprofessional.
The skys your Creative Cloud.,2,Misspelling of “sky’s” creates a glaring grammatical error that diminishes headline quality.
Lets go create with Creative Cloud!,2,Missing apostrophe in “Let’s” creates a noticeable grammar error that forces a low score despite otherwise catchy wording.
Nike: The future is unwritten.,4,"Concise, brand-focused, and intriguing without any spammy elements, but not exceptionally unique."
The run is yet to begin.,3,"Intriguing but vague; offers curiosity without specifying value or context, leading to moderate engagement."
Nike is coming. Can you feel it?,3,"Intriguing and concise but vague about what’s actually coming, limiting clarity and impact."
The race of a lifetime begins with one step.,3,"Inspirational and concise, but vague about the email’s actual content, making it only moderately effective."
The future is Nike-designed.,4,"Concise, on-brand, and futuristic; sparks curiosity without any rule violations."
Nikes best is yet to come.,2,"Missing apostrophe in “Nike’s” shows a clear grammar error, weakening professionalism."
Nikes bold this way comes.,2,Missing apostrophe and awkward phrasing cause a noticeable grammar error that hurts clarity and professionalism.
Nikes Next Move is coming. You can feel it in your soles.,2,"Missing apostrophe in “Nike’s” is a clear grammar error, triggering a hard-fail and reducing headline quality."
"Stay hungry, stay Nike.",4,"Short, catchy play on a famous quote that reinforces brand identity without trigger issues."
Security is the first pillar of trust.,4,"Clear, concise, and grammatically sound headline that communicates value, though somewhat generic."
In iPhone we trust; all others bring data.,4,"Clever riff on a familiar phrase, concise and grammatically sound, though slightly vague about content, it still grabs attention and appeals to iPhone enthusiasts."
Better secure than without iPhone.,2,"Awkward phrasing makes the headline grammatically incorrect, triggering the grammar hard-fail rule."
Secure as iPhones shield.,2,"Unclear, ungrammatical phrase (“iPhones shield”) weakens clarity and professionalism despite acceptable length."
iPhones are unbreakable.,3,"Short, grammatically sound and attention-grabbing, but exaggerated claim may reduce credibility."
"In iPhone we trust, all others bring encryption.",3,"Clever twist on a familiar phrase but slightly vague and not highly descriptive, offering average engagement."
iPhone is forever secure.,3,"Short and grammatically correct but generic and makes a bold claim without context, offering average appeal."
A trusted iPhone in chaos.,3,"Intriguing but vague; decent length and grammar, yet lacks clear value proposition or specificity to strongly entice opens."
iPhone security comes first.,3,"Clear and concise with no errors, but generic phrasing offers limited intrigue or differentiation."
iPhone is the foundation of your security.,3,"Clear, concise and grammatically correct but fairly generic without a strong hook."
"If you snooze, you lose your brew.",4,"Catchy rhyme creates urgency and ties to coffee, concise and error-free."
The brew is always creamier on the Starbucks side.,4,"Creative twist on a familiar phrase, brand-specific, concise, and engaging without spam elements."
The early sip gets the Starbucks brew.,4,"A concise, clever pun that hints at a morning Starbucks offer and piques curiosity without spammy tactics or length problems."
"Starbucks closes, you wait.",2,"Headline is terse and vague, offering little context or appeal, thus unlikely to engage readers."
"Starbucks Coffee steams, but once.",3,Concise and curiosity-driven but vague wording makes benefits unclear and may confuse readers.
"You wait, you miss out. Starbucks Coffee.",3,"Concise and urgency-driven, but vague wording and only moderate appeal limit its effectiveness."
Sip while the coffee is hot.,3,"Clear, concise, but generic and gives limited incentive or detail to drive opens."
The Dyson rises to the clean.,2,"Awkward, unclear phrasing weakens impact and may confuse readers."
The greatest precision in home is to always be cleaning.,2,"Awkward wording like 'precision in home' creates a clear grammar issue, confusing readers and lowering headline quality."
"I am the Dyson champion, my friend.",3,"Creative and grammatically sound but lacks clear value or urgency, making impact only average."
"The harder the dust, the more exquisite the clean.",4,Poetic and concise; evokes a clear cleaning benefit creatively without errors or trigger issues.
The Dyson is in the engineered precision.,2,"Awkward, unclear sentence structure renders the headline grammatically incorrect, invoking the grammar hard-fail rule."
The rest is just dust. — Dyson,4,"Short, clever and brand-specific; hints at product benefit while creating intrigue without spammy elements."
Im the Dyson of the cleaning!,2,Missing apostrophe in “I'm” and awkward phrase “of the cleaning” create clear grammar errors.
To clean and beyond with Dyson!,4,"Catchy Toy Story reference, clear brand mention, concise length, though phrasing slightly awkward yet still engaging."
Theres no place like the Peloton.,2,"Missing apostrophe in “Theres” is an obvious grammar error, automatically lowering the score."
Life is a Peloton ride and Ill live it as a Peloton ride.,2,Missing apostrophe in “Ill” is a clear grammatical error that forces a low score.
Peloton along if you feel like a ride without a limit.,2,"Awkward phrasing makes the headline grammatically incorrect, undermining clarity and effectiveness."
"Just ride Peloton, let the music play.",4,"Concise, rhythmic line ties riding to Peloton’s music experience and feels motivating, though not exceptionally unique."
Jump on Peloton!,3,Concise and energetic but lacks specificity or compelling detail to strongly entice readers.
"Lets get Peloton, Peloton!",2,"Missing apostrophe in “Let’s” is an obvious grammar error, triggering the hard-fail rule."
Ride along if you feel like a room without a roof—Peloton Bike!,2,"Exceeds 60-character limit, so length penalty applies despite creative phrasing."
"Keep on cycling, never stop your Peloton.",3,"Clear and concise but lacks a compelling benefit or urgency, making it average."
The Nintendo Switch adventure is the one that awaits.,3,"Adequate length and no spam triggers, but the wording is vague and awkward, offering limited clarity or urgency to entice readers."
The game of a lifetime awaits.,3,"Intriguing and concise, but generic wording provides limited context or urgency, offering only moderate engagement."
Something legendary this way comes.,4,"Intriguing, concise twist on a familiar phrase sparks curiosity without revealing too much."
Kindle Paperwhite is the reliable foundation of your reading life.,2,"Headline exceeds 60 characters, triggering the hard-fail rule for length."
Trust the Kindles light.,2,"Missing possessive apostrophe makes headline grammatically incorrect, forcing a low score despite concise length."
Light the night with every read.,4,"Concise, evocative line highlights nighttime reading benefit and avoids spam, errors, or length issues."
Trust is the paperwhites promise.,2,"Missing apostrophe for possessive 'paperwhite's' creates a noticeable grammar error, triggering a hard penalty despite otherwise concise wording."
Trust in Kindle Paperwhite with every page.,3,"Clear, concise headline but lacks a compelling benefit or action to strongly entice opens."
Build your library upon this Kindle.,3,"Clear, concise, grammatically correct, but phrasing feels slightly archaic and lacks a strong hook, so impact is only average."
Trust is the shield of knowledge.,3,"Concise and grammatically sound, but abstract wording provides limited clarity about the email’s actual content."
"You snooze, you miss Nespresso!",4,"Short, playful twist on a familiar phrase creates urgency and highlights the Nespresso brand without spammy punctuation or grammatical issues."
Nespresso: Brew while the coffee is hot.,4,"Brand is clear and copy is playful and concise, though the metaphor may cause slight confusion."
Brew before the perfect cup escapes—Nespresso.,3,Intriguing and concise but slightly awkward phrasing limits clarity and impact.
Lifes too short for missing your espresso.,2,Missing apostrophe in “Life's” creates an obvious grammar error that triggers a hard-fail and lowers the headline’s quality.
"You snooze, you miss Nespresso.",4,"Catchy FOMO twist on familiar phrase, concise and brand-specific without any trigger violations."
"You wait, you miss—Nespresso delivers.",4,"Concise, brand-specific headline creates urgency and clarity without spammy punctuation or length issues."
Perfection only knocks once – Nespresso.,4,"Short, intriguing wording conveys scarcity and brand prestige without errors or spammy elements."
Ray-Ban are the king of the world.,2,Incorrect subject-verb agreement undermines clarity and professionalism.
The world is yours through Ray-Ban.,3,"Catchy but vague brand slogan; clear, concise and error-free yet lacks a concrete benefit or urgency."
Ray-Ban Sunglasses are the rebels ultimate accessory.,2,"Missing possessive apostrophe in “rebels” causes a clear grammar mistake, invoking the hard-fail rule."
The Ray-Ban is yours.,4,"Concise, enticing, and personalized; no rule violations though slightly vague brand wording prevents outstanding rating."
The Ray-Ban world is yours.,3,"Clear and concise slogan, but lacks urgency or specific benefit to strongly entice opens."
The world is your Ray-Ban.,4,"Clever brand twist, concise and intriguing, but slightly vague on concrete value."
Ray-Ban sunglasses are forever.,4,"Concise, brand-forward line conveys timeless value without triggers, though it could hint more at an offer or benefit."
The vision is yours with Ray-Ban.,3,"Clear, on-brand, and concise but lacks urgency or a strong value hook."
Ray-Ban sunglasses are timeless.,3,Clear and concise but lacks urgency or a unique value proposition that drives opens.
The best things in life are worth weathering the storm with Patagonia.,2,"Headline exceeds length limit, reducing impact."
"Patagonia calls, and you must go!",4,"Short, clever twist on a famous quote that evokes adventure and compels action without spammy elements."
Go jacketed or go home!,3,"Catchy twist on a familiar phrase but vague about offer, so average impact."
The mountains are calling and Patagonia is ready.,4,"Evocative, brand-specific headline that is concise and engaging, though not particularly unique or benefit-driven."
Patagonias jackets are in the wild!,2,"Missing apostrophe in “Patagonia’s” is a clear grammar error, triggering hard-fail and capping score at 2."
"The Patagonia Jackets are calling, and you must go!",4,"Playful, brand-relevant twist that evokes adventure and prompts action, concise and grammatically sound."
JBL: Youre gonna be surround—wait for it—sound!,2,"Missing apostrophe in 'You're' is a clear grammar error, forcing a hard-fail score."
"JBLs coming, I can feel it in the air.",2,"Missing verb after “JBLs” is an obvious grammar error, invoking the hard-fail rule despite the headline’s brevity."
The sound is an unknown frontier.,3,Short and grammatically sound but vague and offers limited clarity on the email’s value.
"Somethings coming, I can feel it in the JBL sound tonight.",2,"Headline has a clear grammar mistake ('Somethings' instead of 'Something’s'), activating the hard-fail rule despite its creative tone."
"Somethings coming, you can feel it in the bassline.",2,"Missing apostrophe in “Somethings” creates a clear grammar error, triggering the hard-fail rule."
The wait is the hardest sound—JBL delivers.,4,"Creative, concise line links anticipation to sound quality, sparking curiosity without breaking any hard-fail rules."
The JBL Sound is coming. Can you feel the bass?,4,"Clear, engaging teaser that highlights brand and evokes curiosity without length or spam issues."
Safety is the glue of every adventure — GoPro.,4,"Concise, brand-aligned metaphor that evokes safety and adventure yet lacks a strong action or specific benefit."
Trust your GoPro Camera.,3,"Clear and concise but lacks specificity or a compelling hook, yielding an average impact."
Trust is the foundation of every GoPro adventure.,4,"Concise, error-free and brand-aligned; evokes curiosity about trust in GoPro experiences though offer specifics are vague."
You can trust GoPro with every adventure.,4,"Concise, error-free headline that conveys reliability and brand benefit, but lacks a memorable hook to reach outstanding level."
You can trust GoPro if you fall.,3,Clear and concise but lacks specificity or compelling hook to strongly engage readers.
Better trusted than falter.,2,"The phrase is grammatically incorrect, making the meaning unclear and weakening its effectiveness."
Reliable but deliver.,2,"Headline is an incomplete fragment with incorrect grammar, harming clarity and professionalism."
The GoPro never lies.,4,"Short, grammatically sound, brand-specific and curiosity-inducing without any spammy elements."
The early chef gets the OXO touch.,4,"Clever, brand-specific twist on a familiar phrase; concise, intriguing, and grammatically sound."
Better OXO than overcooked.,3,"Catchy and concise pun but lacks clarity on offer, making engagement only average."
The only thing you have to fear is missing OXO.,4,"Clever wordplay on a famous quote grabs attention, is concise, error-free, and directly ties brand FOMO to the reader."
OXO tools are here—but once.,2,"The phrase “here—but once” reads as incomplete and grammatically awkward, undermining clarity and impact."
"You hesitate, you regret. Choose OXO Kitchen Tools.",4,"Concise, compelling call-to-action with clear brand mention and no rule violations."
Fear is the meal-killer—OXO stops it!,3,Intriguing but vague; short and grammatically sound yet unclear benefit may limit open-rate appeal.
The only thing you need to fear is OXO-free cooking.,3,"Catchy twist on a famous quote, but meaning is ambiguous and may confuse readers, yielding only average impact."
"The harder the luggage, the more glorious the arrival.",4,"Catchy metaphor, concise and grammatically sound, effectively piques curiosity about hard-shell luggage."
Your journey is Samsonites.,2,"Incorrect possessive usage (“Samsonites”) creates a clear grammar error, impairing clarity and professionalism."
The Samsonite is your treasure.,3,Clear and short but vague value proposition reduces persuasive impact.
Pride is standing tall with Samsonite when others bow.,4,"Evocative, brand-focused slogan that is clear, concise, and grammatically sound."
Pack boldly in the direction of your adventure.,3,"Creative and concise but somewhat vague on the offer, delivering only average clarity and pull."
The journey is your Samsonite.,3,"Metaphoric line intrigues yet lacks clarity on value or offer, so impact is average."
The world is your Samsonite horizon.,3,"Catchy and concise with brand tie-in, but lacks clarity and urgency to strongly drive opens."
"In order to be irreplaceable, your luggage must always be Samsonite.",2,"Headline runs 68 characters, exceeding the 60-character limit and triggering a hard-fail score."
The Primes the thrill!,2,"Sentence structure is unclear, making the headline grammatically incorrect."
A whole new Prime world awaits you!,4,"Concise, engaging headline highlights novelty and benefit while remaining under length limits and free of spam signals."
Prime is the best everything.,2,Uses incorrect phrasing—'best everything' is a clear grammatical error.
The best things in life are Prime.,4,"Concise, clever twist on a familiar phrase that sparks curiosity and cleanly links to the Prime brand."
Primes the limit!,3,Short and intriguing but too cryptic to convey clear value or context.
The Amazon Prime of a lifetime!,3,"Clear and concise with no hard fails, but message is vague and relies on hype rather than specifics."
Theres a whole new world on Disney+.,2,"Missing apostrophe in “There's” is a noticeable grammar error, triggering a hard-fail score of 2 despite the concise, relevant phrasing."
Disney+s magic is out there!,2,"Plus sign instead of an apostrophe makes the headline look misspelled, triggering the grammar hard-fail rule."
Stories are waiting!,4,"Short, evocative, and curiosity-driven without triggers, though somewhat vague about the specific value."
The Disney+ adventure is just beginning.,3,Clear and concise but generic; lacks specific benefit or urgency to strongly engage readers.
To Disney+s wonder and beyond!,2,"The phrase “Disney+s” is a clear grammatical error, triggering the grammar hard-fail rule."
Magic is here on Disney+.,3,"Clear and concise, but vague and low on specificity or urgency, so average engagement potential."
A whole new show awaits on Disney+.,3,"Clear, concise, and error-free, but generic phrasing offers limited excitement or urgency."
Disney+s magic is yet to stream.,2,"Incorrect punctuation in “Disney+s” signals a grammar error, forcing a hard-fail score."
The next Disney+ adventure is the one youre about to begin.,2,Missing apostrophe in “you’re” creates a noticeable grammar error that triggers a hard-fail.
The wait is Disney+s magic.,2,Misplaced plus sign instead of an apostrophe creates a clear grammar error.
Trust is the foundation of Apple Music.,3,"Solid, clear statement yet lacks urgency or compelling hook to drive opens."
Trust is the rhythm of Apple Music.,3,"Poetic and concise, but vague about the email’s benefit, yielding average effectiveness."
Trust is the glue of Apple Music.,3,"Clear and concise but vague on benefit, offering moderate intrigue without strong punch."
Trust is the glue of Apple Music.,3,"Concise and error-free, but abstract wording offers limited clarity on the email’s actual benefit."
Trust is the hub of endless streams.,3,"Poetic and grammatically sound, but too abstract and benefit-light to compellingly drive email opens."
Apple Music is the backbone of your safety.,2,"Message feels vague and confusing, offering little relevance or clarity to entice readers."
You cant go wrong with Apple Music.,2,Missing apostrophe in “can’t” is a noticeable grammar error that diminishes professionalism.
Apple Music is trusted forever.,2,"Vague, generic statement provides no clear benefit or action, offering little incentive for the reader to open the email."
In Apple Music we trust.,4,"Catchy, brand-focused twist on a familiar phrase; concise and error-free, likely to pique interest."
Apple Music is the one who knows the song in your heart and plays it back when its safely stored.,2,Incorrect use of 'its' instead of 'it's' creates a noticeable grammatical error that reduces professionalism.
The fear of missing out is over with YouTube Premium.,4,"Concise, error-free, under 60 characters, and presents a clear benefit, though wording is somewhat generic."
The only thing to fear is missing out – YouTube Premium stops it.,2,"Headline exceeds the 60-character/12-word limit, invoking the hard-fail rule."
"YouTube Premium: You wait, you lose.",4,"Short, clear and urgency-driven without spam tactics; intriguing but could convey benefit more explicitly."
You cant unwatch what youve watched—but YouTube Premium keeps you ahead of the game.,2,"Missing apostrophes cause clear grammar errors, automatically downgrading the headline to poor quality."
You cant miss a beat on YouTube Premium.,2,"Missing apostrophe in “can’t” is a clear grammar error, triggering hard-fail."
The only thing we have to fear is missing out—YouTube Premium.,2,"Exceeds the 60-character limit, invoking the too_long hard-fail rule."
Missing out is a costly game without YouTube Premium.,4,"Clear, concise headline creates urgency and highlights benefit without triggering spam or length issues."
YouTube Premium stops the clock.,3,"Short and curiosity-driven, yet vague wording makes the benefit unclear, limiting persuasive impact."
HBO Max is the streamer of the world!,3,"Headline is concise and attention-grabbing but phrasing is awkward and less persuasive, yielding only average quality."
Epics are forever.,3,Short and evocative but too vague to convey clear value or prompt action.
The greatest show on HBO Max.,3,Clear but generic and subjective; lacks specificity or urgency to strongly compel opens.
HBO Max is your oyster.,3,"It's short and grammatically correct but the metaphor may feel vague, giving only average clarity about the email’s offer."
"Life is short, grab DashPass first!",4,"Concise, grammatically sound, evokes urgency and clearly names the product without excessive punctuation."
Pure joy is worth the Dash.,3,"Short and evocative but vague about the offer, creating moderate curiosity without clear value."
Treat yourself with DashPass!,3,"Short and clear with brand mention, but generic and lacks a concrete benefit or urgency."
You only live with DashPass.,3,"Creative twist but vague on benefit; grammar fine, length acceptable."
"Fast, furious, and DashPass.",4,"Playful riff on a known phrase, concise, and clearly hints at speedy benefits of DashPass."
Lets DashPass like its the best!,2,"Missing apostrophes in “Let’s” and “it’s” show clear grammar errors, lowering headline quality."
The best meals are free with DashPass!,4,"Short, attention-grabbing and benefit-oriented without any rule violations."
"DashPass, glorious food!",4,"Short, energetic, brand-specific headline that evokes deliciousness without spammy elements or errors."
DashPass makes you so happy you forget to wait!,4,"Catchy, benefit-oriented, concise, and grammatically sound without spammy elements."
The DashPass the merrier!,4,"A short, catchy pun that plays on a familiar phrase while clearly highlighting DashPass, though clarity could be slightly improved."
The Pink is almost here.,3,"Short, grammatically sound, creates curiosity but is vague about the actual offer."
"Lyft Pinks coming, I can feel it in the air.",2,"Missing verb in 'Lyft Pinks coming' is an obvious grammatical error, forcing a low score."
The best rides come to those who Lyft Pink.,4,"Clear, concise, and clever brand play that hints at membership benefit without triggers."
"Lyft Pinks coming, you can feel it in the ride.",2,"Headline lacks a verb after 'Lyft Pinks,' causing an obvious grammatical error."
"Lyft Pinks here, I can feel it in the air.",2,The missing verb/apostrophe in “Lyft Pinks here” makes the headline read awkwardly and ungrammatical.
Lyft Pink: The wait is the easiest part.,4,"Concise, grammatically sound, brand‐specific headline that teases a benefit and builds curiosity without spam indicators."
The Pink is yet to come.,3,Short and curiosity-driving but vague; unusual phrasing may confuse readers and reduce clarity.
"Lyfts arriving, you can see it in the pink.",2,Headline lacks a verb (“Lyfts arriving”) creating an obvious grammatical error that lowers clarity and professionalism.
Lyft Pink this way comes.,3,"Catchy twist on a familiar phrase but vague on value, so average effectiveness."
Theres no stay like Marriott.,2,"Missing apostrophe in 'There's' is a clear grammar error, triggering hard fail."
Marriott Bonvoy stays are your safe haven.,4,"Concise, on-brand line evokes safety and comfort, free of errors or spam tactics."
Trust is the guarantee of stays.,2,"Headline is short but vague and awkwardly phrased, giving little clarity or appeal to readers."
