headline,score,reason
Your vision is Photoshops to craft.,2,"Only brevity and originality pass; unclear grammar, weak hook, no urgency or personalization make it miss most criteria."
Only the brave dare to Photoshop differently.,4,"Creative, concise headline scores high on hook, fit, clarity, and originality, but lacks urgent CTA and uncertain relevance, yielding solid yet not perfect marks."
The only way to create great work is to master Photoshop.,4,"Engaging and clear yet overlong and missing a direct call-to-action, costing brevity and urgency points."
To Photoshop and beyond!,3,"Creative and concise but lacks clear CTA, persona tailoring, and certain relevance to email content."
Youre the Photoshop master of the design world!,3,"Engaging compliment fits designers and reads clearly, but lacks urgency, exceeds length, and accuracy is uncertain without email context."
Photoshop is holding your head up when everyone else has theirs unedited.,2,"Headline lacks hook, brevity, urgency, clear relevance and persona fit, but is readable and non-spammy, so only two dimensions pass."
I am the master of the canvas.,3,"Short, fluent and intriguing without spam traits, but missing urgency, clear relevance and personal fit."
The only Photoshop limit is your imagination.,5,"Inspiring, truthful, concise and fluent headline suits creatives and avoids hype, but slightly lacks a direct call-to-action, meeting six of seven criteria for top marks."
I am the master of Photoshops artistry.,3,"Brief and somewhat enticing, yet lacks urgency, personalization, accuracy context, and has a grammar slip that weakens clarity."
Jump for Creative Cloud!,5,"Short, clear CTA headline fits product, reads naturally, avoids spam, but lacks persona personalization while excelling in all other evaluation areas."
"Design without limits, Creative Cloud.",5,"Compelling, concise line fits creatives and content, reads smoothly, and stays truthful without spam, though urgency is minimal."
The Creative Clouds the playground!,2,"Only brevity and originality pass; unclear grammar, no urgency, uncertain relevance, weak hook and persona fit reduce impact."
Lets paint the Creative Cloud red!,3,"Catchy with a CTA and concise length, but grammar slip, weak personalization and unclear relation to email content cut its effectiveness."
Lets get this Creative Cloud started!,5,"Energetic, concise CTA aligns with Creative Cloud kickoff, fits persona, remains truthful, readable and credible within 37 characters."
"Creative Cloud, what a joyful tool!",5,"Cheerful, concise line aligns with Creative Cloud content and reads naturally; only urgency is missing, so six of seven dimensions succeed."
Creative Cloud: The skys the limit.,2,"Though short and relevant, the cliché phrasing, missing apostrophe, no urgency, and weak originality limit credibility, capping the score despite four passing dimensions."
Lets create ready to shine!,3,"It’s concise and has a mild call-to-action, but weak grammar, vague relevance, limited hook and unknown persona fit drag the headline down."
The skys your Creative Cloud.,3,"Concise and on-topic, yet missing urgency, personalization, strong hook, and has a grammatical error that weakens clarity."
Lets go create with Creative Cloud!,5,"Meets length, relevance, CTA, and tone with no spam signals; minor apostrophe omission doesn't hinder appeal."
Nike: The future is unwritten.,3,"Concise and intriguing, yet it offers no urgency, personalization, or clear link to specific email content, reducing overall conversion potential."
The run is yet to begin.,3,"Brief and fluent, yet vague with no CTA or clear persona fit, limiting impact."
Nike is coming. Can you feel it?,4,"Engaging, concise, and credible, but lacks a clear call-to-action and personalization, so it meets most criteria yet misses urgency and persona alignment."
