headline,score,reason
Youre invited to the Black Card club.,2,"Missing apostrophe in “You’re” is a clear grammatical error, triggering the grammar rule."
I am the Black Card of Planet Fitness!,3,Creative but vague; sparks curiosity yet lacks clarity on benefit or content.
Black Card of Planet Fitness!,3,"Clear and concise but lacks specificity or compelling benefit, resulting in average appeal."
We are the Black Card.,3,Clear and short but vague; offers intrigue yet lacks specific benefit or call-to-action.
Youre invited to the Planet Fitness Black Card Lounge.,2,"Missing apostrophe in “You’re” is a clear grammar error, forcing a hard-fail score of 2."
Planet Fitness Black Card: The Club is Ours.,3,"Clear and concise branding, but limited intrigue and benefit description keep it average."
The best things in life are Bloomberg-curated.,4,"Catchy twist on a familiar phrase, concise and brand-reinforcing without rule violations."
Bloomberg Insights are wealths engine!,2,Headline has a grammatical error (“wealths engine”) reducing credibility.
Bloombergs insights—the skys unlocked!,2,Missing apostrophes and misspelling of “sky’s” make the headline look unprofessional despite its brevity.
Bloombergs the limit.,2,"Missing apostrophe makes the headline grammatically incorrect, triggering the grammar hard-fail rule."
The Bloomberg skys the horizon.,2,"The misspelling of “skies” is a clear grammatical error, triggering a hard-fail."
The best insights are yet to come with Bloomberg.,3,"Clear and grammatically sound but vague and generic, offering limited specificity or urgency."
Bloomberg makes the markets go round.,4,"Clever twist on a familiar phrase, concise and error-free, though value proposition could be clearer."
The past is a foreign country; AncestryDNA unlocks it there.,4,"Creative twist on a familiar quote, concise and brand-relevant, though phrasing after semicolon is slightly awkward."
Every family has its AncestryDNA story.,4,"Concise, emotionally appealing, and brand-specific, it invites readers to explore their own story without gimmicks."
The answers will set you exploring with AncestryDNA.,3,Curiosity-evoking but vague wording and slightly awkward phrasing make it only moderately engaging.
The secrets are in your DNA.,4,"Concise, curiosity-driven line with correct grammar and no spam signals, though not uniquely creative enough for a top score."
"To trace where youre going, you must discover where youve been with AncestryDNA.",2,"Headline exceeds 60 characters, triggering automatic length penalty despite otherwise solid wording."
Whats past is your roadmap.,2,"Missing apostrophe in “What’s” creates an obvious grammar error, triggering a low score."
The past is never gone. Its in your AncestryDNA.,2,"Missing apostrophe in “It’s” is a clear grammar error, forcing downgrade."
Your story is within your DNA.,4,"Concise, grammatically sound, and sparks curiosity about personal genetics without resorting to clickbait."
The story is in your DNA. AncestryDNA reveals it.,4,"Concise, curiosity-driven line ties personal intrigue to the brand, with clear grammar and length well within best-practice limits."
The past is your ancestryDNA map.,3,"Intriguing yet vague wording, no rule violations, but lacks strong clarity or urgency."
Trust is the foundation that holds your genetic future together.,2,"Headline is clear but exceeds the 60-character limit, triggering a length penalty."
Safety in Your DNA,4,"Concise, curiosity-provoking and grammatically sound, though slightly vague about the specific benefit."
Better secure with 23andMe than sorry.,4,"Catchy twist on a familiar proverb, concise, brand-specific, and free of spammy elements."
Your DNA is safe with 23andMe.,4,"Clear, concise reassurance about security that addresses a key customer concern without errors or spammy tactics."
Trust is the foundation of genetic safety with 23andMe Plus Membership.,2,"Headline exceeds 60-character limit, invoking hard-fail rule despite otherwise clear messaging."
Safety in genes with 23andMe Plus Membership.,4,"Creative play on words, clear benefit and brand mention, concise and error-free."
Your DNA is safe with 23andMe Plus Membership.,3,"Clear reassurance message but lacks emotional hook or urgency, making it moderately effective."
"Sony: You wait, you miss out.",4,"Concise, brand-specific subject line creates urgency without spam tactics, though details of the offer are not revealed."
Hurry up before Sonys deal expires!,2,"Missing apostrophe in “Sony’s” is a clear grammatical error, triggering a hard-fail."
The fear of missing out is Sonys past.,2,"Missing apostrophe in 'Sony's' creates a grammatical error, triggering hard-fail and lowering headline quality."
You miss 100% of the moments you dont capture with Sony.,2,"Missing apostrophe in 'don't' creates a grammar error, triggering the hard rule and lowering the headline's overall effectiveness."
The only thing to fear is missing Sony.,4,"Clever play on a famous quote, concise and engaging, though slightly vague about the specific Sony offer."
Sonys time waits for no one.,2,"Missing apostrophe in “Sony’s” creates an obvious grammar error, hurting professionalism."
You miss every second of the moments you dont capture with Sony.,2,"Misspelled “dont” violates grammar rule and headline exceeds 60 characters, triggering hard-fail with poor perceived quality."
The Sony catches the future.,2,Awkward article usage makes the headline feel ungrammatical and unclear about its message.
Sony is the FOMO killer.,3,"Intriguing, concise and curiosity-driven, but too vague about the actual benefit or offer."
The best way to shape your future is with Panasonic innovation.,2,"Headline exceeds 60-character limit, invoking hard-fail rule despite otherwise decent quality."
Panasonics the limit.,2,"Missing apostrophe causes a clear grammar error, triggering a hard-fail downgrade."
Innovation distinguishes Panasonic from the rest.,3,Clear and concise but generic; lacks urgency or specific benefit to motivate opens.
Panasonic excellence is forever.,3,"Short and grammatical but generic, offers no clear benefit or hook to drive opens."
Panasonic rises to top-tier.,4,"Concise, grammatically correct, creates intrigue about Panasonic’s upward move without exaggeration."
The innovation is yet to be seen.,3,"Clear and grammatically correct, but vague and lacks a concrete benefit or hook."
The thrill of innovation is Panasonic.,3,Vivid but vague; implies excitement yet lacks clarity or tangible benefit to entice opens.
Reach out and touch Lenovos future.,2,"Missing apostrophe in “Lenovo’s” is a clear grammar error, triggering a hard-fail."
The future is yet to come with Lenovo.,3,"Clear and concise but vague and cliché, offering little specific value or intrigue."
Lenovos best is yet to come!,2,Missing apostrophe in “Lenovo’s” is an obvious grammar error that undermines professionalism.
The latest innovations in tech are Lenovo.,2,Headline contains a grammatical error (“are Lenovo”) which disrupts clarity.
The joy is yet to come with Lenovo!,3,"Grammatically sound and concise, but vague and generic without a compelling, specific benefit."
The future is HP-powered.,4,"Concise, grammatically sound, brand-focused intrigue but somewhat vague on specific benefit."
HPs future is limitless.,2,"Missing apostrophe in “HP’s” is a clear grammatical error, forcing a low score."
The future of HP is yet to come.,2,"Headline is vague and redundant, offering little intrigue or clear value to readers."
"Somethings coming, feel it in HPs future.",2,"Missing apostrophes in “Something’s” and “HP’s” create obvious grammar errors, forcing a low score."
May the future be with you — HP.,4,"Clever, concise twist on a familiar phrase, branded clearly, with no spammy or grammatical issues."
"The futures so HP-powered, you gotta wear next-gen specs!",2,Incorrect grammar ('The futures') forces downgrade despite catchy concept.
"HPs coming, I can feel it in the air.",,
"The futures so bright, powered by HPs light.",2,"Missing apostrophes in 'future's' and 'HP's' cause grammatical errors, triggering the grammar hard-fail rule."
Acer laptops are a strong defense.,3,Clear and concise but somewhat vague; lacks compelling detail to strongly engage readers.
Reliability is the backbone of every Acer device.,3,"Clear, grammatically correct and concise but generic, offering limited curiosity or urgency."
Acer is the glue of your digital life.,3,"Clear, concise and grammatically correct, but vague on benefits and urgency."
Acer is the shield of life.,2,"Vague, metaphorical phrasing fails to convey clear value or subject matter, reducing click-worthiness."
"Trust us, were your tech guard.",2,"Headline contains a grammatical error, reducing clarity and professionalism."
Acer is the foundation of tech.,3,"Vague, hype-driven claim creates mild curiosity but lacks specificity and clear value for the reader."
Trust is the foundation of everything with Acer.,3,"Clear and concise with correct grammar, but generic and lacks a compelling hook."
He who hesitates is outmatched by Intel.,4,"Concise, grammatically sound twist on a familiar proverb that sparks competitive curiosity without triggering spam or length penalties."
The early upgrader gets performance.,4,"Catchy twist on a proverb, concise and engaging, though meaning is somewhat vague."
Dont hesitate until its too late with Intel.,2,"Missing apostrophes in “Don't” and “it's” create noticeable grammar errors, lowering quality."
You miss 100% of the opportunities you dont take with Intel.,2,"Missing apostrophe in 'don’t' is a clear grammar error, forcing a low score."
"The technology is already here, its just not fully unlocked yet.",2,Obvious grammar error with “its” instead of “it’s” triggers the grammar hard-fail rule.
The only thing we have to fear is not using Intel.,4,"Clever twist on a famous quote grabs attention, concise and error-free, though somewhat dramatic but still relevant to Intel."
Time is Intels ally.,2,Missing apostrophe in “Intel’s” shows a clear grammar error triggering the hard-fail rule.
"You snooze, you fall behind—Intel keeps you ahead.",4,"Concise, grammatically sound, creates urgency and positions Intel as the solution without spammy elements."
He who delays is left behind by Intel.,3,"Concise, curious phrasing but somewhat vague about benefit or action, offering average engagement."
AMD is the king of processors!,3,Clear and concise but generic hyperbole; lacks specific benefit or curiosity driver.
"AMD isnt everything, but wanting to win is.",2,"Missing apostrophe in “isn't” creates a noticeable grammatical error, triggering hard fail."
We are the architects of tomorrows technology.,2,Missing apostrophe in “tomorrow’s” is a basic grammar error that lowers headline quality.
The best way to build the future is AMD.,3,"Catchy but slightly vague; acceptable length and grammar, yet lacks clear benefit or call-to-action."
"The future is bright, the future is AMD.",4,"Catchy, succinct, positive tagline that clearly positions AMD, though slightly derivative and lacks specific value proposition."
Nothing is impossible with AMD.,3,Clear and concise but vague; inspirational tone yet lacks specificity about value or offer.
AMD is unstoppable.,3,"Short and punchy but vague about the benefit or topic, limiting clarity and appeal."
IBM Solutions Are Here Again!,3,Short and correct but generic; conveys little value proposition beyond IBM’s return.
Turn it up to IBM Cloud!,3,"Energetic and short but wording is slightly awkward, offering limited clarity on benefit."
The skys IBMs future to what we can build.,2,"Headline has multiple grammatical errors and unclear phrasing, triggering grammar hard-fail."
"IBM is a party, and so are you!",3,"Catchy and short, but wording is vague about the email’s value and could confuse readers about IBM actually ‘being a party.’"
IBMs innovations are yet to shine.,2,"Missing apostrophe in “IBMs” creates a grammar error, triggering a hard-fail."
"IBM: Dont worry, be happy.",2,"Missing apostrophe in “Don’t” is a clear grammar error, triggering hard-fail."
"Oracles insights are in the cloud, waiting to be found.",2,"Missing possessive apostrophe in “Oracle’s insights” makes the headline grammatically incorrect, triggering a hard-fail."
"Oracle is here, just waiting to be unlocked.",3,"Concise and grammatically sound, but vague about benefits, limiting its persuasive impact."
What lies ahead is Oracles future.,2,"Missing possessive apostrophe in “Oracle’s” creates a clear grammatical error, invoking the hard-fail rule."
"Oracles coming, you can feel it in the air.",2,Missing verb (“are”) produces a noticeable grammatical error that harms clarity.
Oracles future is now scripted.,2,"Missing possessive apostrophe creates a clear grammatical error, undermining credibility despite concise length."
The Oracle is coming. Can you handle it?,4,"Intriguing, concise, grammatically sound headline that sparks curiosity without spammy tactics."
Oracle: the future is yours to write.,3,"Concise, grammatically sound and aspirational, but vague and low urgency."
"Oracles coming, I can feel it in the cloud tonight.",3,"Catchy lyric twist grabs attention, but vagueness and unclear benefit keep impact average."
Something Oracle-powered this way comes.,4,"Clever, concise twist on a familiar phrase sparks curiosity without triggers or length issues."
Oracles Future This Way Comes.,2,"Missing apostrophe in “Oracle’s” causes a clear grammatical error, reducing clarity and professionalism."
Trust is the backbone of business—Salesforce.,3,"Clear and concise with no errors, but generic and offers little intrigue or action."
Salesforce is the backbone of your business.,3,"Clear and concise but generic, offers little intrigue or specific value to drive opens."
Trust in Salesforce with all your heart.,3,Clear and concise but generic; lacks specific benefit or urgency to entice opens.
Trust is the Salesforce of business.,3,"Intriguing and concise but the analogy risks confusion, offering average clarity and appeal."
Trust is the Salesforce of business.,3,"Short and error-free but metaphor feels vague, so impact is average."
Trust is the core of business.,3,"Clear and concise with correct grammar, but generic and not highly compelling."
"In case of need, trust Salesforce.",3,"Grammatically fine and concise, yet vague and generic, offering limited clarity or incentive for the reader."
Messages is a thief — Slack catches them all.,2,"Subject-verb disagreement in 'Messages is' creates a clear grammar error, triggering the hard-fail rule."
What you dont see in Slack cant hurt your team.,2,Missing apostrophes in 'don't' and 'can't' create noticeable grammar errors that reduce headline quality.
Messages seldom wait in Slack twice.,3,"Concise and error-free but lacks clarity and a strong hook, making it an average headline."
The fear of missing Slack messages is real.,4,"Concise, grammatically sound, evokes relatable FOMO about Slack, likely to engage relevant recipients."
Budweiser is king of the world!,3,"Short and energetic but generic superlative offers little context or benefit, generating only moderate interest."
Better to raise Budweiser than settle for heaven.,4,"Clever wordplay, concise length, and error-free grammar make it engaging without triggering spam or length penalties."
We are the Budweiser champions!,3,"Short, grammatically sound and attention-grabbing, but vague about value or action, so only average effectiveness."
"Budweiser: Celebrate, live like a Bud King!",4,"Catchy and concise with brand focus and energetic tone; no grammar issues or spam traits, though the message is somewhat generic."
Budweiser is king of the world!,3,"Short, catchy headline without hard-fail issues, but offers limited information and relies on vague hype."
"The harder the challenge, the more glorious the Budweiser moment.",2,"Headline exceeds 60 characters, triggering the too_long hard-fail rule."
Budweiser is the king of the world!,3,Concise and grammatically sound but generic hyperbole limits uniqueness and engagement.
All you need is Toyota.,4,"Concise, grammatically sound, memorable twist on a familiar phrase, but slightly generic branding limits impact."
Life is a Toyota adventure.,3,"Short, grammatically sound, but generic and lacks a clear value proposition."
"Life is a Toyota highway, I wanna drive it all night long!",4,"Lyric twist is memorable and on-brand, with correct length and grammar, delivering an energetic, attention-grabbing message."
"Life is a Toyota, I want to drive it all night long!",3,"Playful and within length limits but vague about value, so average impact."
"Life is a Toyota journey, I want to cruise it all night long!",2,"The headline has 13 words, exceeding the 12-word limit, so it triggers the too_long hard-fail rule."
"Life is a highway, drive with Toyota.",4,"Catchy, concise phrase leverages a familiar metaphor and brand name without length or spam issues, though it lacks specific offer detail."
"Life is a Toyota highway, I want to drive it all night long.",2,"The headline exceeds the 12-word limit, activating the too_long hard-fail rule."
"Its not about the destination, its about the Toyota drive.",2,Missing apostrophes in both instances of “Its” create visible grammatical errors that undermine headline professionalism.
"Life is a ride, I want to cruise it all night in a Toyota.",2,"Headline exceeds the 12-word limit, causing an automatic downgrade."
The anticipation is the BMW era.,2,"Unnatural phrasing creates a clear grammatical issue, making the headline confusing and weak."
"BMWs coming, I can feel it in the air.",2,"Headline lacks the verb “are,” making it grammatically incorrect and thus triggers the grammar hard-fail rule."
The journey is BMWs unfolding.,2,"Headline contains awkward phrasing and missing apostrophe, creating a noticeable grammar error."
Something BMW this way comes.,4,"Clever, concise wordplay evokes curiosity about a forthcoming BMW without violating length or spam rules."
"BMWs coming, I can feel it in the engines roar.",,
BMWs future is yet to come.,2,"Missing apostrophe in “BMW’s” is a clear grammatical error, automatically lowering the headline’s score."
BMWs power this way comes.,2,Missing possessive apostrophe and awkward phrasing create an obvious grammar issue.
BMWs future is unleashed.,2,"Missing apostrophe in ""BMWs"" creates a grammar error that triggers a hard fail."
The next BMW is yet to come.,3,"Short, intrigue-based headline but vague and slightly awkward phrasing limits impact and clarity."
Mercedes-Benz is the first virtue in the art of driving.,3,"Within length and grammar rules, but wording is vague and metaphorical, reducing clarity and impact."
Mercedes-Benz is the glue of every journey.,3,"Metaphorical phrasing is intriguing but slightly vague, offering moderate impact without any rule violations."
Mercedes-Benz: Safety is no accident.,4,"Concise, on-brand slogan communicates value clearly without errors or spam signals, enticing readers effectively."
Safety is the glue that holds every journey together.,2,"At 61 characters, the headline exceeds the 60-character limit despite solid wording."
Trust is the Mercedes-Benz of life.,3,"Intriguing metaphor and concise length, but vague value proposition limits impact."
Trust in Mercedes-Benz with all your heart.,3,"Clear and grammatically sound but vague, offering emotion without a concrete benefit or call-to-action."
Better reliable than sorry — Mercedes-Benz.,2,Unnatural phrasing (“Better reliable than sorry”) is a clear grammar issue that weakens clarity and impact.
Better Pre-Safe than sorry.,4,"Short, clear play on a familiar phrase that piques curiosity without any spam signals or grammar issues."
Trust in Mercedes-Benz with every journey.,4,"Concise, brand-focused headline conveys reliability benefit clearly without spam tactics, although somewhat generic."
Dont let your Meal Deal be the one that got away.,2,Missing apostrophe in “Don't” is an obvious grammar error that triggers the hard-fail rule.
Nothing to miss but the fries.,3,Short and witty but vague; intrigue exists yet lacks clear value or context.
The early bird gets the McDonalds fries.,3,"Catchy twist on a familiar phrase but lacks clarity about offer, making it only moderately compelling."
The only thing to skip is McDonalds itself.,3,"Intriguing and concise but somewhat vague about the email’s actual value, giving only average engagement potential."
Time is burgers gone!,2,"Headline is confusing and ungrammatical, failing to convey a clear message."
Time waits for your Big Mac.,3,"Catchy twist on a familiar phrase but meaning is vague, offering moderate intrigue with limited clarity."
You miss 100% of the Big Macs you dont grab.,2,Missing apostrophe in “don’t” creates a noticeable grammar error that triggers the hard-fail rule.
"We are the KFC legends, my friends.",3,Catchy but vague; passes all hard-fail checks yet lacks clear benefit or specificity.
KFCs king of the world!,2,"Missing apostrophe makes the headline ungrammatical, triggering the grammar hard-fail rule."
KFC doesnt serve anything less here.,2,"Missing apostrophe in “doesnt” is a clear spelling error, lowering headline quality."
KFCs secret is better than fast food.,2,"Missing apostrophe in “KFC’s” constitutes a clear grammatical error, invoking the hard-fail rule."
KFC is the king of the world!,3,"It’s short and attention-grabbing, but vague hyperbole provides little information or incentive."
We are the crispest.,2,"Vague statement with no context or benefit for the reader, offering little reason to open."
…,1,"An ellipsis alone conveys no clear information or incentive, making the headline essentially useless."
We are KFCs champions.,2,Missing apostrophe in “KFC’s” creates a noticeable grammar error that undermines professionalism.
Life is a sub!,3,"Catchy and concise, but too vague to convey clear value or context, reducing its persuasive impact."
"Sub, glorious sub!",,
Life is a Subway feast.,3,"Catchy brand play line but vague on benefit, offering average engagement."
Subway is what you eat fresh.,3,"Clear, short, no triggers, but wording is awkward and lacks a compelling hook."
"Life is short, eat Subway first.",4,"Catchy, concise, brand-focused line evokes urgency and humor without errors or spam tactics."
Subways the flavor limit!,2,"Headline lacks a verb and clear meaning, triggering the grammar hard rule."
Sandwich on my plate makes me happy.,3,"Grammatically sound and concise but lacks urgency or clear value proposition, offering only mild engagement."
"Life is a Subway, grab it all night long.",3,"Catchy but vague; pun risks confusion and lacks clear value or action, yet meets length and grammar standards."
Visa: Adventure is out there.,3,"Short, clear branding with travel sense but lacks specific benefit or urgency, so average impact."
Why settle for the Visa destinations you know?,4,"Concise, grammatically sound, curiosity-driven question that invites exploration without spammy elements."
The world is Visas oyster.,2,"Missing apostrophe in “Visa’s” is an obvious grammatical error, triggering the grammar hard-fail rule."
Visa: The adventure is yet to come.,3,"Short and clear with a hint of intrigue, but vague about benefit and lacks a strong call-to-action."
"Visa calls, and the worlds yours to discover.",2,"Missing apostrophe in “worlds” makes headline grammatically incorrect, triggering hard-fail."
The Visa Goes Ever On and On.,4,"Catchy literary twist grabs attention and fits length guidelines, though it could hint more clearly at the email’s specific visa-related content."
The world is your Visa.,4,"Concise, grammatically clean, and creatively links travel possibilities with the Visa brand, making it attention-grabbing and memorable."
The journey of your Visa card awaits.,3,"Clear and concise, but slightly vague and lacks a compelling benefit or call-to-action."
"Visas coming, and you dont know what it is.",2,Missing apostrophe and verb agreement create obvious grammar errors that weaken credibility.
"Trust, but Mastercard verifies.",4,"A concise, clever twist on a familiar phrase that highlights Mastercard’s role, though impact depends on reader knowing the original saying."
Safety is the glue of every transaction.,3,"Clear and concise with a mild metaphor, but lacks strong specificity or urgency."
"Better guarded than sorry, Mastercard.",3,"Catchy twist on a familiar phrase, but message and benefit are somewhat unclear, limiting impact."
The security stops with Mastercard.,3,"Clear and short but wording feels awkward, possibly confusing readers about intended security benefit."
Youve got a friend in Mastercard.,2,Missing apostrophe in “You’ve” creates a clear grammatical error that diminishes headline quality.
Trust is the shield of every transaction.,4,"Concise, grammatically sound metaphor that builds intrigue and value without spam signals."
Your payments are forever secure.,3,"Clear and concise but generic and uses an unrealistic absolute, offering only average engagement."
PayPal: Opportunity seldom waits twice.,3,"Clear and short with mild intrigue, but idiom feels off and value proposition is vague."
"You snooze, you miss your chance.",3,"Catchy urgency phrase without errors, but vague about offer, making it only moderately compelling."
FOMO is history with PayPal.,4,"Short, intriguing and benefit-oriented headline with clear brand tie-in, no rule violations."
The only thing to fear is missing PayPal itself.,3,"Clever wordplay catches attention but message is vague and benefit unclear, yielding average effectiveness."
