headline,score,reason
Trips await you around the globe.,3,"Grammatically sound and concise, but generic wording offers limited urgency or specificity."
The adventure is yet to explore. Booking.com.,2,"Grammatical error renders the headline confusing and unprofessional, lowering its effectiveness."
"Adventure booked, I can feel it.",4,"Short, intriguing, error-free, and energizing, though not highly specific about the benefit or next step."
The best is yet to come with Booking.com.,3,"Clear, on-brand and within length limits, but generic phrasing offers limited specificity or urgency."
The world is a book; book it all with Booking.com.,4,"Clever wordplay, clear travel-booking call-to-action, concise length, and clean grammar create an engaging headline."
Trust is the guarantee of safe travel.,3,"Grammatically sound and concise, but vague and lacks a clear, specific benefit or call-to-action to strongly entice opens."
Trust is the glue of your Expedia journey.,3,"Clear and concise with correct grammar, but abstract wording offers limited incentive or specificity, making it only moderately compelling."
Travel safely is the golden thread.,2,"The phrase uses incorrect grammar, making the headline unclear and awkward."
Better trusted with Expedia than sorry.,2,"Awkward phrasing lacks proper grammar, undermining clarity and professionalism."
Trust is the glue of safe journeys.,3,"Grammatically sound and concise, but abstract wording offers limited clarity or compelling specifics to entice readers."
Expedia is the glue of travel.,3,"Metaphorical line is grammatical and concise but vague, offering little clarity on value or action."
You can trust Expedia on every trip.,3,Clear and grammatically sound but generic; offers trust assurance without a compelling hook.
Trust is the journey of travel.,2,"Vague wording offers little clarity or incentive, leaving readers unsure what the email is about."
He who hesitates is missing out on Facebook.,3,Creative urgency but vague benefit and mild relevance limit engagement.
Facebook: FOMO is optional.,4,"Short, clear and intriguing; evokes curiosity with a modern term while remaining grammatically sound and within length limits."
You miss 100% of the posts you dont share on Facebook.,2,Missing apostrophe in “dont” is a clear spelling error forcing a low score despite catchy wording.
"Out of Facebook, out of mind.",4,"Catchy, concise wordplay grabs attention without spam cues, though message purpose is somewhat vague."
"Porsche arrives, you can feel it in the air tonight.",4,"Creative, concise headline sparks curiosity and excitement about the Porsche arrival while staying within length and style guidelines."
"Porsches coming, I can feel it in the air.",2,"Missing verb after “Porsches” makes the headline grammatically incorrect, causing a hard-fail downgrade."
The best Porsche models are worth waiting for.,3,"Clear and grammatically sound, but fairly generic with limited urgency or uniqueness."
The desire for acceleration.,3,"Intriguing but vague title lacks context, offering moderate curiosity without clear relevance or benefit."
"Porsches coming, cant you feel it?",2,Missing apostrophe and incorrect verb agreement cause clear grammar errors that trigger a hard-fail.
The Porsche isnt for everyone.,2,"Missing apostrophe in “isn't” creates a noticeable grammatical error, triggering hard rule."
"Speed calls, but only a few will drive.",3,"Intriguing and error-free, yet cryptic wording reduces clarity and persuasive power."
The wait is the best part – Porsche.,4,"Intriguing, on-brand, concise headline sparks curiosity without spam tactics or errors."
Drive it and they will trust.,3,"Concise and curiosity-driven but vague and pronoun-heavy, offering limited clarity about the email’s value."
Safety is the foundation of every Audi journey.,4,"Clear, concise headline conveys a strong benefit tied to the Audi brand without any grammar errors or spammy elements."
Trust is the first law of every Audi journey.,4,"Concise, error-free and brand-aligned; evokes emotion and curiosity without overselling."
Safety is the foundation of your journey.,3,Clear and concise but generic; lacks specificity or compelling hook to strongly engage readers.
Trust is the safety net of driving.,3,Clear and concise but abstract; lacks specificity to strongly entice open-rates.
Safety is the shield of your journey.,3,"Metaphorical message is clear and concise but generic and lacks specificity or urgency, resulting in average impact."
Safetys got to be there. Audi.,2,"Missing apostrophe in “Safety’s” creates a clear grammar error, triggering a hard-fail and weakening the headline’s professionalism."
Better shielded than shaken.,3,"Catchy and concise play on words, but vague about content and benefits, limiting impact."
"Reliability first, Audi performance second.",3,"Clear and concise, but lacks urgency or a specific benefit that would make it more compelling."
"You snooze, you miss out on Kia!",4,"Catchy, concise urgency headline that mentions the brand, free of spammy elements or errors."
"You wait, you lose Kias deal.",2,"Missing apostrophe in “Kia’s” creates an obvious grammatical error, triggering the hard-fail rule."
The only thing you have to fear is missing out on Kia.,4,"Clever, on-brand twist on a famous quote, concise length, no spammy elements or grammatical flaws."
Drive while the iron is now.,2,"Phrase is garbled and ungrammatical, making the headline unclear."
The early buyer catches the Kia deal.,4,"Concise, grammatically sound, and creatively urgent play on a familiar phrase that highlights a Kia offer."
"You hesitate, you miss your Kia.",3,"Creates urgency but wording feels awkward and offers no clear benefit, resulting in average engagement appeal."
The only thing to fear is missing out on the rush to drive Kia.,2,"Headline exceeds 60 characters and 12 words, triggering the too_long hard-fail rule."
Kia arrives but once.,3,"Short and grammatically sound but too vague to clearly convey value, yielding only moderate engagement potential."
You only Kia once.,4,"Short, clever brand pun that grabs attention without length or spam triggers, though meaning may be mildly ambiguous."
"You Wait, You Miss Out on Kia!",3,"Clear urgency and brand mention, but phrasing feels slightly awkward and lacks specific benefit, making it average."
Im Gucci of the runway.,2,Missing apostrophe in “I’m” creates a clear grammatical error that triggers the grammar hard-fail.
Gucci is the king of the world!,3,Catchy hyperbole grabs attention but is vague and lacks clear value proposition.
You cant rush Gucci perfection.,2,"Missing apostrophe in “can’t” is a clear grammar error, triggering a hard fail despite otherwise concise, brand-aligned copy."
The Gucci are different from you and me.,4,"Clever, concise play on a well-known quote; sparks curiosity without breaking length or grammar rules."
Gucci is the top!,3,"Clear and short but vague, lacks compelling detail or offer to fully engage readers."
Gucci is the king of the world!,3,"Catchy but vague and hyperbolic, offering little detail on email value though it avoids any hard-rule violations."
The universe is your Gucci.,3,"Creative and concise, but vague metaphor limits clarity and may confuse readers about the email’s actual content."
The exclusivity is Guccis.,2,Missing apostrophe in “Gucci’s” creates a noticeable grammar error that undermines professionalism.
The Gucci clientele are different from the rest.,3,"Clear and concise, but lacks urgency or specificity to strongly entice the reader."
"Seize the joy with Louis Vuitton, for tomorrow never comes.",4,"Short, evocative, urgency-driven headline that highlights the luxury brand without spam tactics or errors."
Louis Vuitton means effortless joy.,4,"Concise, emotive and brand-aligned with no rule violations, though somewhat vague on concrete value."
"LouVuitton is a journey, not a destination.",2,"Misspelling the well-known brand ruins credibility and triggers a grammar hard fail despite a succinct, thematic concept."
The skys the LV experience.,2,Misspelling/grammar error in 'skys' undermines professionalism and clarity.
A spoonful of Louis Vuitton elegance makes the routine go down.,2,Exceeds 60-character limit despite creative phrasing.
The joy of Louis Vuitton is the happiness of living.,3,"Poetic and error-free but vague, offering little clarity or concrete benefit to the reader."
Lets get LVd and never be dazzled.,2,Missing apostrophe in “Let's” is an obvious grammar error triggering a hard-fail.
You only travel once—make it Louis Vuitton.,4,Concise luxury appeal with a memorable twist; strong branding and urgency make it engaging despite slight cliché.
"Pradas coming, and I dont know what it is!",2,"Missing apostrophes and incorrect tense create obvious grammar errors, forcing a hard-fail downgrade."
"Pradas coming, I can feel it in the air tonight.",2,"The headline contains an obvious grammatical error ('Pradas coming'), reducing clarity and triggering the grammar hard rule."
"Pradas arriving, I can feel it in the city tonight.",3,Creative but vague; unclear offer and informal grammar weaken clarity and impact.
"Pradas coming, you can taste it in the air.",2,"Missing verb/apostrophe makes the headline read as an error, lowering clarity and professionalism."
The Prada moment is now arriving.,4,"Intriguing, brand-focused phrase creates urgency without spam tactics, though wording feels slightly abstract, reducing immediate clarity."
The future is darkest before the reveal.,3,"Intriguing and concise, yet vague and lacks a clear benefit or subject, so it may not strongly motivate opens."
"Pradas coming, I can see it in the leather.",2,"Missing verb/apostrophe in “Pradas coming” creates a glaring grammatical error, hurting clarity and professionalism."
"Safety, but guaranteed.",2,Incorrect use of “but” creates a grammatical error that undermines clarity and professionalism.
Hermès is forever.,4,"Concise, on-brand, grammatically correct, and evokes timeless luxury without trigger issues."
Hermès craftsmanship is forever trusted.,3,"Clear and concise, but lacks a strong hook or actionable benefit, yielding only moderate engagement."
Hermes craftsmanship is your unwavering protection.,3,"Concise and error-free, but the benefit feels vague and abstract, offering little context or urgency."
Trust is the essence of every journey with Hermes.,4,"Concise, error-free headline conveys emotion and brand value, though not particularly novel or action-oriented."
Trust is the guarantee of your journey.,3,"Grammatically fine and concise, but vague wording makes the benefit and relevance unclear, yielding only average engagement."
Hermès: Trust is the foundation of every journey.,4,"Concise, grammatically sound, brand-relevant and evocative, though slightly generic in specificity."
The early bird gets the H&M sale!,4,"Catchy play on a familiar phrase, clear brand mention, creates urgency without spammy elements."
The H&M shoppers get the drops.,3,"Awkward phrasing obscures meaning and appeal, though it’s concise and free of major errors."
"You snooze, you lose H&M.",3,"Catchy and concise but phrasing is slightly awkward, making the offer less immediately clear."
"You wait, H&Ms out!",2,Awkward phrasing and punctuation create a grammatical error that confuses the reader and weakens the headline.
"You hesitate, you lose out.",3,"Short and urgent but vague about the offer, providing limited incentive to open."
You miss 100% of H&M styles you dont try.,2,Missing apostrophe in “don’t” creates a visible grammar error that triggers a hard-fail reduction.
Lost outfits are never seen again.,3,"Intriguing line with correct length and grammar, but vague and weak on value or action, so only average impact."
"H&M: You snooze, you lose!",4,"Concise, brand-led headline creates urgency without spam tropes, though it lacks specifics of the offer."
Targets the leader of the deals!,2,"Verb form makes sentence fragment, causing awkward grammar and unclear meaning."
The Target is yours.,3,"Short and curiosity-driven but vague; lacks clear benefit or context, so effectiveness is only average."
"Targeting isnt ordinary, its the only thing.",2,Missing apostrophes in “isn’t” and “it’s” is an obvious grammatical error that reduces credibility.
The Targets the limit.,2,"Headline has obvious grammatical error, undermining clarity and professionalism."
You are the master of your Target style.,3,"Grammatically sound and concise, but somewhat generic and lacks a strong hook or clear benefit."
Best Buy joy is here again!,3,"Cheerful and concise with no hard issues, but vague on specific value or offer, limiting its persuasive power."
"Your life is a party, Best Buy-style!",3,"Playful and short but vague, offering no clear benefit or action."
"Dont wait, be joyful.",2,"Missing apostrophe in “Don't” creates a noticeable grammar error, triggering a hard-fail score."
The tech is yet to come… at Best Buy.,4,"Clever twist on a familiar phrase and concise, but vague about what tech or offer awaits."
The Best Buy is yet to come.,3,"Intriguing but vague; acceptable length and grammar, yet lacks clear value or action cue."
The skys the Best Buy!,2,"Misspelling of “sky’s” violates grammar standards, forcing a low score despite otherwise intriguing headline."
The best tech in life is at Best Buy.,4,"Concise, grammatically sound play on a familiar phrase that clearly conveys value, though not exceptionally creative or urgent."
"Lowes dream home is waiting, are you ready?",2,Missing apostrophe in Lowe’s and comma splice create clear grammar errors that lower the headline’s quality.
"Lowes innovations are coming, and you cant wait to see what happens!",2,"Missing apostrophes in “Lowe’s” and “can’t,” plus headline exceeds 60 characters, trigger a hard-fail for grammar and brevity."
The project is almost here at Lowes.,3,"Clear and concise but lacks excitement and specific benefit, delivering only average engagement potential."
Create it with Lowes and your vision comes.,2,Incorrect wording and missing apostrophe create a grammatical error that confuses readers and triggers the grammar hard-fail.
"Where were building, we dont need tools—Lowes delivers.",2,"Missing apostrophes and incorrect wording create clear grammatical errors, forcing a hard-fail rating."
Renewals are coming—you can feel it at Lowes.,3,"Concise and relevant but lacks clear benefit or strong hook, making it only moderately engaging."
The future is yet to come at Lowes.,3,"Clear and concise but vague, clichéd wording offers little value proposition or specificity, resulting in an average headline."
"Renewals are arriving, you can feel it in the air.",3,"Within length limits and error-free, but vague and light on benefit, so only moderately compelling."
The greatest home project in life is anticipation.,3,"Grammatically sound and concise, but vague and overly philosophical, offering limited clarity or urgency about email content, resulting in only moderate engagement potential."
Reliability is the first law of nature.,3,Grammatically sound and concise but vague; lacks clear benefit or context for the reader.
"Verizons network is not the whole story, but without it the story ends.",2,"Missing apostrophe in “Verizons” is a clear grammatical error, automatically dropping the headline to a poor score despite its otherwise engaging message."
Trust is Verizons glue of safety.,2,Missing apostrophe in “Verizon's” and awkward phraseology reveal clear grammar issues that undermine professionalism.
Trust is the foundation of your connection.,3,"Clear and grammatical but vague and generic, offering limited incentive to open."
Trust is the network of reliability.,3,"Grammatically correct and concise, but abstract phrasing offers limited clarity or compelling value."
Verizon is forever reliable.,3,"Clear and grammatically correct but generic and unexciting, offering limited incentive to open."
Trust is the foundation of connections.,3,"Clear and concise but generic, offering limited intrigue or specificity to compel opens."
Trust is the network of life.,3,"Clear and concise but vague; intrigues without specifying value, making it only moderately compelling."
Verizon is the glue of reliable connections.,3,Metaphor hints at reliability but phrasing is awkward and lacks a clear benefit or call to action.
"You wait, you miss out on T-Mobile!",3,"Urgency is clear and concise, but phrasing is awkward and value proposition vague, yielding only average effectiveness."
Deals wait for no one.,4,"Concise, grammatically sound and urgency-driven, though a bit generic."
Dont let T-Mobiles deal be the one that got away.,2,Missing apostrophes in 'Don't' and 'T-Mobile's' create clear grammatical errors that undermine professionalism.
The only thing you have to fear is missing out on T-Mobile.,4,"Clever twist on familiar quote, clear value hint, concise and grammatically sound, though not exceptionally unique."
T-Mobile waits for no one.,3,"Intriguing and concise but vague on value or action, limiting its persuasive impact."
"If you wait, you miss out.",3,"Concise and urgency-driven, but generic and nonspecific, offering limited information or intrigue."
The fear of missing out is over.,3,"Clear and concise but somewhat vague, offering limited specifics or intrigue."
"You wait, you miss T-Mobile!",2,"Headline is short but vague and grammatically awkward, offering little clarity or persuasive value."
Chipotles best is yet to be tasted.,2,"Missing apostrophe in “Chipotle’s” creates a clear grammatical error, triggering hard-fail and lowering score."
Chipotles burrito is almost here.,2,"Missing apostrophe in “Chipotle’s” makes the headline grammatically incorrect, invoking the hard-fail grammar rule despite its concise length."
"The flavor is coming, you can taste it in the air.",2,"A clear comma-splice makes the headline grammatically incorrect, invoking the hard-fail rule."
The crunch is almost here!,3,"Intriguing and concise without errors, but vague and lacks clear benefit or context to strongly compel opens."
The wait for Chipotle is almost over.,4,"Clear, concise, and enticing subject line that sparks curiosity about Chipotle’s upcoming availability."
The craving is almost here.,3,"Intriguing but vague, lacks clear benefit or context, so only average impact."
Flavor is coming. Chipotle.,3,"Intriguing and concise but vague, offering limited value proposition or urgency."
"The crunch is almost here, Chipotle.",3,Intriguing but vague; grammatically sound and concise yet lacks clarity on product or offer.
The best burritos come to those who choose Chipotle.,4,"Clear, on-brand and concise headline that conveys value but lacks standout creativity."
Dunkin: A reliable brew is a strong defense.,4,"Concise, grammatically sound, brand‐specific headline with a clever metaphor that engages without spammy elements."
You can always count on Dunkin.,3,Solid grammar and length but the generic brand statement offers little detail or incentive to open.
Ill be there for you like Dunkin in the morning.,2,"Missing apostrophe in “I’ll” is an obvious grammar error, triggering hard fail."
"In times like these, you need a Dunkin you can count on.",4,"Concise, on-brand, emotionally reassuring line that avoids spam tactics and grammatical issues."
"Trust in Dunkin, as the brew is strong.",3,"Concise and grammatically fine, yet wording feels awkward and lacks a clear value hook or urgency."
Trust is the foundation of your day.,3,"Grammatically sound and concise, but generic wording provides limited context or compelling incentive to open the email."
Trust is built through Dunkins consistency.,2,"Missing apostrophe in “Dunkin’s” is a clear grammar error, invoking hard-fail."
Dunkin is the glue of safety.,2,"Headline is grammatically fine but vague and confusing, offering little clarity or appeal about the email’s content."
Better with Dunkin than sorry.,3,"Clever play on a familiar phrase yet vague about the email’s actual content, limiting clarity and impact."
Dunkin is the glue of life.,3,"Short, error-free, quirky metaphor but vague on value, yielding average appeal."
"You snooze, you miss IKEA.",4,"Catchy play on a familiar phrase, short and curiosity-driving, though it could hint more clearly at the specific benefit or offer awaiting inside."
The only thing we have to miss is IKEA itself.,3,"Clever play on a famous quote, yet vague about content or benefit, so appeal and clarity are only average."
Urgency is the mind-killer. IKEA.,3,"Unusual, brand‐linked, and concise but cryptic; lacks clear value proposition so engagement is uncertain."
IKEAs deal knocks but once.,2,"Missing apostrophe in 'IKEA's' creates a clear grammar mistake, lowering the headline’s quality."
Time waits for those who wait.,3,"Intriguing and concise but vague; lacks clear relevance or incentive to open, yet contains no hard-rule violations."
Time waits for no IKEA deal.,4,"Short, on-brand twist on a familiar phrase creates urgency and clarifies offer without spam tactics."
The early shoppers get the IKEA furniture.,4,"Clever spin on a familiar saying, concise and grammatically solid, effectively conveys urgency and relevance to IKEA furniture."
Dont let IKEA slip through your hands.,2,"Missing apostrophe in ""Dont"" is a clear grammar error, triggering a low score."
The early UPS catches the prize.,3,No hard-rule violations; punny but vague headline offers limited clarity on the email’s actual value.
"UPS isnt everything, but wanting to deliver is.",2,"Missing apostrophe in “isnt” is a clear grammar error, triggering hard-fail."
The thrill of delivery.,3,Concise and intrigue-building but too vague about benefits or context to be compelling.
"The harder the route, the sweeter the delivery.",3,"Catchy metaphor but somewhat vague on value, average attention-grabbing power."
UPS delivers greatness.,3,"Concise and grammatically correct but vague, offering limited specific value or intrigue for recipients."
Excellence is doing UPS deliveries flawlessly.,3,Grammatically correct and concise but lacks a clear benefit or compelling hook to drive opens.
UPS is the crown of delivery success.,3,"Grammatically sound and concise, but its vague metaphor lacks clarity and urgency, making it only moderately engaging."
Happy days are within reach—today.,3,"Clear and concise with hopeful tone, but lacks specificity or compelling detail to strongly entice opens."
"Because Im here, unpack joy!",2,"Missing apostrophe in “Im” creates a noticeable grammatical error, triggering the hard-fail rule."
Whats in the DHL package?,2,"Missing apostrophe in “What’s” constitutes a clear grammatical error, triggering the grammar hard-fail rule."
The happiest moments come in small shipments.,3,"Catchy and error-free but vague about the offer, providing only average clarity and relevance."
A gift is a treasure even if wrapped in DHLs care.,2,"Missing apostrophe in “DHLs” is an obvious grammar error, triggering a poor score."
"Dont worry, be DHL happy.",2,"Missing apostrophe in 'Don't' is a clear grammar error, forcing a low rating despite the concise, catchy pun."
DHL Deliveries make life brighter!,3,"Short, grammatically sound, but the benefit is vague and lacks specific appeal."
The joy is delivered daily!,3,"Upbeat and concise, but vague wording offers little concrete value or context to drive engagement."
Reeboks adventure awaits!,2,"Missing possessive apostrophe in “Reeboks” creates an obvious grammar error, triggering a hard-fail score of 2."
Something bold this way leaps.,3,"Intriguing poetic twist but vague about value, acceptable length and grammar."
The Reebok adventure belongs to those who train for it.,4,"Engaging, concise and grammatically sound motivational line that includes brand while inviting action, though slightly vague on specific offer."
Reeboks breaking.,2,Verb missing after subject; headline reads as fragment rather than a complete thought.
"Reeboks coming, I can feel it in the soles tonight.",4,"A catchy, concise pun that teases Reebok arrivals without spammy or grammatical flaws."
The horizon is unleashed.,3,"Grammatically correct and concise but too vague to convey clear value, giving it just average appeal."
Somethings Reebok-ready.,2,"Misspelling and unclear phrasing undermine clarity, triggering the grammar rule and limiting effectiveness despite concise length."
"Buckle up, its going to be a big Reebok race.",2,Missing apostrophe in “it’s” is a clear grammar error that reduces professionalism.
"Your futures coming, you can taste it in the air.",2,"Missing apostrophe in “future’s” makes grammar incorrect, triggering hard-fail."
The Lululemon gear is built to endure.,4,"Clear, concise headline highlights durability benefit and brand, with no length, grammar, or spam issues."
Lululemon is the foundation of safety.,2,"Grammatically fine but vague and confusing, offers no clear benefit or reason to open the email."
Youre in Lululemon gear.,2,"Missing apostrophe in “You’re” signals a basic grammar error, undermining professionalism."
Trust comes first with Lululemon.,3,Clear and concise but offers no specific benefit or intrigue to motivate opens.
Lululemon is the glue of your practice.,3,"Metaphorical and concise but somewhat vague, offering limited clarity or urgency to engage."
A fitness journey of every step begins with Lululemon.,2,Awkward phrasing ('journey of every step') creates a clear grammar issue that weakens clarity and impact.
Steady as Lululemon goes.,3,"A short, pun-based headline that is grammatically sound but offers limited clarity or compelling detail."
